name,about_us,source,cb_id,cb_desc
tesoro-corporation,,F500,tesoro-corporation,"Tesoro Corporation, together with its subsidiaries, engages in refining and marketing petroleum products in the United States. It operates in two segments, Refining and Retail. The Refining segment refines crude oil and other feed stocks into transportation fuels, such as gasoline, gasoline blend stocks, jet fuel, and diesel fuel, as well as other products, including heavy fuel oils, liquefied petroleum gas, petroleum coke, and asphalt. This segment also sells refined products in the wholesale market primarily through independent unbranded distributors; and in the bulk market primarily to independent unbranded distributors, other refining and marketing companies, utilities, railroads, airlines and marine, and industrial end-users in the western United States. It owns and operates 6 refineries with a combined crude oil capacity of approximately 845 thousand barrels per day. The Retail segment sells gasoline, diesel fuel, and convenience store items through company-operated retail stations, and third-party branded dealers and distributors in the western United States. It operated approximately 2,200 retail stations, including approximately 595 company operated stations under the Tesoro, Shell, ARCO, and USA Gasoline brands. Tesoro Corporation was founded in 1939 and is headquartered in San Antonio, Texas."
textron,,F500,textron,"Textron Inc. is a multi-industry company that leverages its global network of aircraft, defense, industrial and finance businesses to provide customers with innovative solutions and services. Textron is known around the world for its powerful brands such as Bell Helicopter, Cessna Aircraft Company, Jacobsen, Kautex, Lycoming, E-Z-GO, Greenlee, and Textron Systems."
the-home-depot,,BD,the-home-depot-corporate,"The Home Depot, Inc., together with its subsidiaries, operates as a home improvement retailer.  The company's stores sell a range of building materials, home improvement products, and lawn and garden products to do-it-yourself, do-it-for-me (D-I-F-M), and professional customers.  It also offers installation services to D-I-F-M customers. These installation programs include products, such as carpeting, flooring, cabinets, countertops, and water heaters.  In addition, the company provides professional installation of various products, such as generators, and furnace and central air systems that are sold through its in-home sales programs.  As of December 31, 2009, it had 2,244 The Home Depot stores located throughout the United States, including the Commonwealth of Puerto Rico and the territories of the U.S. Virgin Islands and Guam; Canada; China; and Mexico.  The Home Depot, Inc. was founded in 1978 and is based in Atlanta, Georgia."
thermo-fisher-scientific,,BD,thermo-fisher-scientific,"Thermo Fisher Scientific Inc. (NYSE: TMO) is the world leader in serving science. Their mission is to enable their customers to make the world healthier, cleaner and safer. With revenues of more than $10 billion, they have approximately 35,000 employees and serve customers within pharmaceutical and biotech companies, hospitals and clinical diagnostic labs, universities, research institutions and government agencies, as well as in environmental and process control industries. They create value for their key stakeholders through two premier brands, Thermo Scientific and Fisher Scientific, which offer a unique combination of continuous technology development and the most convenient purchasing options. Their products and services help accelerate the pace of scientific discovery, and solve analytical challenges ranging from complex research to routine testing to field applications."
thomson-reuters,,BD,thomson-reuters,"Thomson Reuters is a multinational media and information firm that delivers critical information from the financial, legal, risk, accounting, intellectual property, science, and media markets. The company sells electronic content and services to professionals primarily on a subscription basis. Its financial and risk segment offers news, and information and analytics, as well as enabling transactions that brings together communities to allow trading, investing, financial, and corporate professionals to connect. This segment also provides regulatory and operational risk management solutions. 

The legal segment offers critical online and print information, decision tools, and software and services to support legal, investigation, business, and government professionals. This segment’s products and services include legal research solutions; know-how solutions; software-based workflow solutions; compliance solutions; marketing, finance, and operations software; litigation support tools; and business development and legal process outsourcing services. 

The tax and accounting segment provides integrated tax compliance and accounting information, software, and services for professionals in accounting firms, corporations, law firms, and government. The intellectual property and science segment offers intellectual property and scientific information, and decision support tools and services that enable governments, academia, publishers, corporations, and law firms to discover, protect, and commercialize new ideas and brands. Thomson Reuters also operates Reuters, which provides real-time multimedia news and information services to newspapers, television and cable networks, radio stations, and websites. 

Thomson Reuters was incorporated in 1977 and is headquartered in New York, United States."
thrivent-financial-for-lutherans,,F500,thrivent-financial,"Thrivent Financial create financial strategies that help Christians be wise with money and live generously. They  offer a broad range of financial products and services, including life insurance, annuities and mutual funds, plus tailored guidance from financial representatives nationwide. For more than a century, they have helped their member-owners show God's love to others by being good stewards of the gifts they've been given."
timberland,,BD,timberland,Timberland LLC is an American manufacturer and retailer of outdoors wear with a focus on footwear.
time-warner-cable,,BD,time-warner-cable,"Time Warner Cable is a cable telecommunications company that offers a range of home entertainment and information services and products. The company’s service portfolio includes video on-demand, digital video recorder, high speed data services, communication tools, email, personal computer security, parental controls, online radio services, voice services, and next-generation home automation and monitoring services.

The company also delivers some additional business services that comprise data services, including Internet access, network services, and wholesale transport services; and video services such as various video programming tiers, and music services.

As of December 2013, the company served approximately 15 million customers. It has operations in the New York State, the Carolinas, Ohio, Kentucky, Wisconsin, Southern California, and Texas.

Time Warner Cable was established in 1989 and is headquartered in Herndon, Virginia."
tractor-supply,,BD,tractor-supply-company,"Tractor Supply Company is the largest operator of rural lifestyle retail stores in the United States. The company operates over 1,500 retail stores in 49 states, employs more than 23,000 team members and is headquartered in Brentwood, Tenn. Its stock is traded on the NASDAQ exchange under the symbol ""TSCO"".   The company was founded in 1938 as a mail order catalog business offering tractor parts to America's family farmers. Today Tractor Supply is a leading edge retailer with annual revenues of approximately $6.2 billion.   Tractor Supply stores are located primarily in towns outlying major metropolitan markets and in rural communities. The typical Tractor Supply store has about 16,000 square feet of selling space inside, with a similar amount of outside space."
travelcenters-of-america-llc,,F500,travelcenters-of-america-llc,"TravelCenters of America LLC (TravelCenters), headquartered in Westlake, Ohio, is a leading travel center business in 43 states and Canada operating under the TA® and Petro Stopping Centers® brands. With 249 convenient full-service locations off interstate highway exits, TA and Petro Stopping Centers offer customers diesel and gasoline fueling services, more than 500 full- and quick-service restaurants, 24-hour convenience stores, heavy truck maintenance services, RoadSquad Connect™ (24/7/365 emergency roadside service), Reserve-It™ (truck parking reservations), and many other services – all within large, high traffic facilities. TravelCenters also operates gasoline/convenience stores in Kentucky and Tennessee under the Minit Mart brand name. For more information on TravelCenters and TA, please visit www.tatravelcenters.com. For more information on Petro Stopping Centers, please visit www.petrotruckstops.com"
travelers,,BD,travelers-insur,"In an uncertain world, Travelers is an insurance leader, committed to keeping pace with the ever-changing needs of their customers, and anticipating their needs for the future. There is no stronger testament to their dedication to protecting customers from loss than their continued innovation and ability to transform their industry.  In fact, from the first ever auto and space travel policies and hybrid car discount, to the 2009 founding of The Travelers Institute for public policy, their history of advancements has propelled their company—and their industry—towards ever higher standards for customers.  Travelers is a company that works hard at the science of what they do: they analyze information, process perspectives and measure results to create the best combination of products and services. They work equally hard at customer service and how they interact with the people whom they do business. Over the years, they've strived to earn their customer's loyalty by continually improving their abilities to listen and respond to their needs."
treehouse-foods,,BD,treehouse-foods,"TreeHouse Foods rises above to provide quality food products primarily for the private label and foodservice industries.  Founded in 2005, TreeHouse has expanded its branches through acquisitions to create a product portfolio which includes non-dairy powdered coffee creamer, canned soup, salad dressings and sauces, sugar-free drink mixes and sticks, instant oatmeal and hot cereals, macaroni and cheese, skillet dinners and other value-added side dishes and salads; salsa and Mexican sauces, jams and pie fillings under the E.D. Smith brand name, pickles and related products, products, and other food products including aseptic sauces, refrigerated salad dressings, and liquid non-dairy creamer."
trident,,BD,trident-microsystems,"Trident Microsystems, Inc. (NASDAQ: TRID) is a leading force in the digital home entertainment market, delivering innovative semiconductor solutions for digital televisions and set-top boxes â€“ at the heart of today's digital home. With spectacular 2D and 3D picture quality, surround-sound and Internet-ready connectivity platforms, Trident's semiconductor solutions bring consumers a world of diverse, rich and immersive multimedia entertainment that can be accessed at any time, and from anywhere in the home."
tripadvisor,,BD,tripadvisor,"TripAdvisor is a free travel guide and research website. It provides reviews of travel-related content and includes interactive travel forums.    Apart from the obligatory reviews of hotels and other attractions, TripAdvisor has many skillful features. Its users are able to quickly and easily post their vacation videos and travel marketers are able to showcase their properties by featuring their videos on the website.    TripAdvisor also offers a personalization tool that allows its users to save hotel, restaurant, and attraction reviews to personalize their My Trips folders. Travelers are able to customize and expand their plans by adding maps, photos, their own notes, and travel plan details. Through the website's Check Rates feature, users are able to check hotel pricings and availabilities across multiple vendor commerce sites.    TripAdvisor also operates sister sites in other countries such as the U.K., Italy, Spain, Germany, France, Ireland, Japan, and India.   TripAdvisor was launched on February 1, 2000."
twitter,,BD,twitter,"Twitter is a global social networking platform that allows its users to send and read 140-character messages known as “tweets”. It enables registered users to read and post their tweets through the web, short message service (SMS), and mobile applications.   As a global real-time communications platform, Twitter has more than 400 million monthly visitors and 255 million monthly active users around the world. Twitter’s active group of registered members includes World leaders, major athletes, star performers, news organizations, and entertainment outlets. It is currently available in more than 35 languages.   Twitter was launched in 2006 by Jack Dorsey, Evan Williams, Biz Stone and Noah Glass. Twitter is headquartered in San Francisco, California, USA, with local offices in Atlanta, Austin, Boston, Boulder, Chicago, Detroit, Los Angeles, New York, Sunnyvale and Washington.   Twitter's international offices are located in Amsterdam, Berlin, Dublin, London, Madrid, Paris, Rio de Janeiro, Sao Paulo, Singapore, Sydney, Seoul, Tokyo, Toronto and Vancouver."
tyson,,BD,tyson-food,"Tyson Foods, Inc. is the largest American-owned processor and marketer of chicken, beef, and pork.  Tyson Foods, Inc. (NYSE: TSN), founded in 1935 with headquarters in Springdale, Arkansas, is one of the world's largest processors and marketers of chicken, beef and pork, as well as prepared foods. The company provides products and services to customers throughout the United States and more than 90 countries.   Tyson employs 115,000 Team Members at more than 400 facilities and offices in the U.S. and around the world."
ulta-salon-cosmetics,,BD,ulta-salon-cosmetics-fragrances,"ULTA Beauty is the largest beauty retailer in the United States and the premier beauty destination for cosmetics, fragrance, skin, hair care products and salon services. Since opening its first store 25 years ago, ULTA Beauty has grown to become the top national retailer providing All Things Beauty, All in One Place™. The Company offers more than 20,000 products from over 500 well-established and emerging beauty brands across all categories and price points, including ULTA Beauty's own private label. ULTA Beauty also offers a full-service salon in every store featuring hair, skin and brow services. ULTA Beauty is recognized for its commitment to personalized service, fun and inviting stores and its industry-leading Ultamate Rewards loyalty program."
united-technologies,,BD,united-technologies,"United Technologies Corporation provides technology products and services to the building systems and aerospace industries worldwide. Its Otis segment designs and manufactures escalators, moving walkways, and passenger and freight elevators. The company's Carrier segment offers residential, commercial, and industrial HVAC and refrigeration systems and equipment; food service equipment; building automation and controls; and HVAC and refrigeration components, as well as provides retrofit and aftermarket services. Its UTC Fire & Security segment provides fire and special hazard detection and suppression systems, fire fighting equipment, electronic security, monitoring, and rapid response systems and service, as well as offers security personnel services. The company's Pratt & Whitney segment supplies aircraft engines for the commercial, military, business jet, and general aviation markets; industrial gas turbines; space propulsion systems; and spare parts, as well as provides fleet management services, and maintenance, repair, and overhaul services. United Technologies' Hamilton Sundstrand segment offers aerospace products, including power generation, management and distribution systems, flight systems, engine control systems, environmental control systems, fire protection and detection systems, auxiliary power units, propeller systems, and industrial products, such as air compressors, metering pumps, and fluid handling equipment. This segment also provides aftermarket services, such as spare parts, overhaul and repair, engineering and technical support, and fleet maintenance programs. Its Sikorsky segment manufactures military and commercial helicopters, as well as provides aftermarket helicopter and aircraft parts and services. In addition, the company develops geothermal power systems and fuel cell power plants for stationary, transportation, space, and defense applications. United Technologies Corporation was founded in 1934 and is based in Hartford, Connecticut."
unitedhealth,,BD,unitedhealth-group,"UnitedHealth Group is the most diversified health care company in the United States and a leader worldwide in helping people live healthier lives and helping to make the health system work better for everyone.  UnitedHealth Group  are committed to introducing innovative approaches, products and services that can improve personal health and promote healthier populations in local communities.  Our core capabilities in clinical care resources, information and technology uniquely enable us to meet the evolving needs of a changing health care environment as millions more Americans enter a structured system of health benefits and  UnitedHealth Group  help build a stronger, higher quality health system that is sustainable for the long term."
univar,,F500,univar,"Univar is one of the world's leading distributors of industrial and specialty chemicals. Univar represents over 2,500 chemical producers and provides its customer base, made up of 80,000 customers, with a full portfolio of products. Univar operates a network of 300 distribution facilities throughout North America, Europe, the Asia-Pacific region, and Latin America, with additional sales offices located in Eastern Europe, the Middle East, and Africa. In 2011, Univar reported sales of $9.7 billion."
universal-health-services,,F500,universal-health-services,"Universal Health Services, Inc. (UHS) is one of the nation's largest and most respected healthcare management companies, operating through its subsidiaries acute care hospitals, behavioral health facilities and ambulatory centers nationwide, in Puerto Rico and the U.S. Virgin Islands. Founded in 1978 by Alan B. Miller, Chairman and CEO, UHS subsidiaries employ more than 60,000 individuals. UHS maintains one of the strongest balance sheets in the industry and is rated investment grade by Moody's, Standard & Poor's and Fitch. This strong capital position has enabled the company to develop and acquire many new facilities over the past few years."
universal-music-group,,BD,universal-music-group,"Universal Music Group provides recorded music, music publishing, and merchandising services worldwide.  It discovers and develops songwriters, and owns and administers copyrights to musical compositions for use in recordings, public performances, and related uses such as films and advertisements; and sells artist and music branded products through multiple sales points including online, fashion retail, and live performances worldwide.  Universal Music Group was founded in 1998 and is headquartered in Santa Monica, California. Currently, it operates as a subsidiary of Vivendi Société Anonyme."
upc,,BD,upc-insurance,"UPC writes and services residential property and casualty insurance policies through a network of independent agents. We currently write policies in Florida, Georgia, Louisiana, Massachusetts, New Jersey, North Carolina, Rhode Island, South Carolina, and Texas. We are also licensed in Alabama, Connecticut, Delaware, Maryland, Mississippi, New Hampshire and Virginia. UPC plans to expand into additional states throughout the country (view map). We offer products in homeowners, dwelling fire and for flood coverage UPC is a Write Your Own Flood Carrier. Recently, we added a commercial residential product in Florida with plans to expand to other states."
us-foods-holding-corp,,F500,us-foods,The US Foods Facebook page is a gathering place for foodservice industry professionals and people who love food and share our passion for Keeping Kitchens Cooking with innovative food ideas and stories about food people.
veritiv-corp,,F500,veritiv,"Veritiv is a North American leader in business-to-business distribution solutions. Helping shape your business success drives everything they do. Their name is based on this commitment and on the core strengths of their business. Derived from verity, it says they are true to their word, their beliefs, and your needs. The words connective and active in their name signify that they collaborate with you to create solutions that work hard for your business.   In today’s rapidly evolving marketplace, you need an edge. You want to increase efficiency, productivity, predictability and sustainability while cutting costs. Their packaging, print, facility, publishing and print management solutions span the entire lifecycle of business operations so you can achieve these goals. And with their industry-leading expertise, proprietary tools and creative ideas, you’ll get the help you need to stay ahead."
vf-corporation,,F500,vf-corporation,"V.F. Corporation (VF) is a global apparel company based in the United States. The Company designs and manufactures or sources from independent contractors a variety of apparel and footwear for all ages, including jeanswear, outerwear, footwear, packs, luggage, sportswear, and occupational and performance apparel. Products are marketed primarily under VF-owned brand names. It is a diversified apparel company across brands, product categories, channels of distribution and geographies. These products are marketed to consumers shopping in specialty stores, upscale and traditional department stores, national chains and mass merchants. These groupings of businesses are called coalitions and consist of the following: Outdoor & Action Sports, Jeanswear, Imagewear, Sportswear and Contemporary Brands."
visteon-corporation,,F500,visteon,"Visteon is a leading global automotive supplier that designs, engineers and manufactures innovative climate, electronics and interior products for vehicle manufacturers. With corporate offices in Van Buren Township, Mich. (U.S.); Shanghai, China; and Chelmsford, UK; the company has facilities in 28 countries and employs approximately 22,000 people."
vmware,,BD,vmware,"VMware, Inc. provides virtualization solutions. The company was founded in 1998 and is headquartered in Palo Alto, California.  Its virtualization platform products include _Player_ that enables individuals to run virtual machines on their desktops; _Fusion_, a desktop virtualization product for users of Intel-based Apple Macintosh computers; _Workstation_ for software developers and enterprise IT professionals; _Server_, which enables virtual partitioning of a server; _ESX Server_, an enterprise-class virtualization platform that runs directly on the hardware; _Virtual SMP_ that enables a virtual machine to use four physical processors simultaneously; and _VMFS_, which allows multiple ESX Servers to share block-based storage.  The company also offers _VirtualCenter_ that provides a central point of control to manage a virtualized IT environment; _VMotion_, which allows users to move virtual machines; _DRS_ that creates resource pools from physical servers; _HA_, which provides automated recovery from hardware failure; _Consolidated Backup_ that enables LAN-free automated backup of virtual machines; _Storage VMotion_, which allows live migration of virtual machine disks; _Update Manager_ that automates patch and update management; _Capacity Planner_, which enables VMware service providers to perform capacity assessments onsite; _Converter_ to convert local and remote physical machines into virtual machines; _Lab Manager_ to automate the setup, capture, storage, and sharing of multi-machine software configurations; _ACE_ that allows desktop administrators to protect company resources against the risks presented by unmanaged desktops; _Virtual Desktop Infrastructure_ to host individual desktops inside virtual machines running on centralized servers; _Virtual Desktop Manager_, a desktop management server that connects users to virtual desktops in the data center; and _VMware Lifecycle Manager_ that provides control over the virtual environment."
walmart,,BD,walmart,"Walmart is a multinational retail corporation that operates several chains of discount department and warehouse stores.  The company’s segments include Walmart U.S., Walmart International, and Sam’s Club. The Walmart U.S. segment is a mass merchandiser of consumer products operating under the Walmart or Wal-Mart brands as well as walmart.com. It also offers digital services such as Vudu and InstaWatch. It offers a full line of grocery items, including meat, produce, deli, bakery, dairy, frozen foods, alcoholic and non-alcoholic beverages, floral, and dry grocery as well as consumables such as health and beauty aids, baby products, household chemicals, paper goods, and pet supplies; health and wellness services such as pharmacy, optical, over-the-counter drugs, and clinical services; entertainment products, including electronics, toys, cameras and supplies, photo processing services, cellular phones, cellular service plan contracts and prepaid services, movies, music, video games, and books; stationery, automo..."
