name,about_us,source,cb_id,cb_desc
21st-century-fox,"21st Century Fox is the world's premier portfolio of cable, broadcast, film, pay TV and satellite assets spanning six continents across the globe. Reaching more than 1.8 billion subscribers in approximately 50 local languages every day, 21st Century Fox is home to a global portfolio of cable and broadcasting networks and properties, including FOX, FX, FXX, FXM, FS1, Fox News Channel, Fox Business Network, FOX Sports, Fox Sports Network, National Geographic, STAR India, 28 local television stations in the U.S. and more than 350 international channels; film studio Twentieth Century Fox Film; and television production studios Twentieth Century Fox Television and a 50% ownership interest in Endemol Shine Group. The Company also holds a 39.1% ownership interest in Sky, Europe’s leading entertainment company, which serves 22 million customers across five countries.  For more information about 21st Century Fox, please visit www.21CF.com.",BD,21st-century-fox,"21st Century Fox is an American multinational mass media corporation. It is one of two companies created from the 2013 split of News Corporation (as founded by Milo and Mary Switz in 1979); 21st Century Fox retains the previous News Corporation's broadcasting and film assets and serves as its legal successor, while its publishing assets were spun off to form News Corp at the same time. The split was designed to ensure that both companies are operated under more ""focused"" management, which Murdoch claimed would ""unlock"" their true value. Among its holdings are Fox Entertainment Group—owners of the 20th Century Fox film studio and Fox television network among other assets, pan-Asian pay channel operator STAR TV, Italian television provider Sky Italia, and stakes in the television providers BSkyB and Sky Deutschland."
3m,,BD,3m,"3M operates as a diversified technology company, manufacturing more than 55,000 products, including adhesives, abrasives, laminates, passive fire protection, dental and orthodontic products, electronic materials, medical products, car-care products, electronic circuits, and optical films. The company operates in the industrial and transportation; health care; safety, security and protection services; consumer and office; display and graphics; and electro and communications businesses. Its industrial and transportation business serves a range of markets, such as appliance, paper and packaging, food and beverage, electronics, automotive original equipment manufacturer, and automotive aftermarket.

3M has operations in more than 65 countries that include 29 international companies with manufacturing operations and 35 companies with laboratories. Its products are available for purchase through distributors and retailers in more than 200 countries, and online directly from the company.

3M was founded in 1902 by [Joshua Jones](https://www.crunchbase.com/person/joshua-jones) and is headquartered in Saint Paul, M.N."
abbott-labs,,BD,abbott,"Abbott Molecular Inc., a genomic disease management company, engages in the development and marketing of clinical laboratory products, which provide information critical to the evaluation and management of cancer, prenatal disorders, and other genetic diseases. It currently markets seven U.S. Food and Drug Administration or foreign cleared or approved clinical products in addition to distributing over 300 Analyte Specific Reagent and research products through its direct sales operations in the United States and Europe and a worldwide distribution network covering 59 countries. The company was founded in 1991 and is based in Des Plaines, Illinois. As on 12/05/2001, Abbott Molecular Inc. operates as a subsidiary of Abbott Laboratories Inc."
abbvie-inc,,BD,abbvie,"AbbVie is a global, research-based biopharmaceutical company formed in 2013 following separation from Abbott. The company's mission is to use its expertise, dedicated people and unique approach to innovation to develop and market advanced therapies that address some of the world's most complex and serious diseases.   In 2013, AbbVie employs approximately 21,000 people worldwide and markets medicines in more than 170 countries."
activision-blizzard,,BD,activision,Activision (NASDAQ: ATVI) is an American video game developer and publisher. It was the first independent developer and distributor of video games for gaming consoles.
adp,,BD,adp,"Automatic Data Processing, Inc. (ADP) is one of the largest providers of business processing and cloud-based solutions – including payroll, talent management, human resource management, benefits administration and time and attendance – to employers and automotive dealerships around the world. We build configurable solutions that can fit your organization's unique goals and increase your productivity.  ADP serves about 620,000 organizations in more than 125 countries, including 425,000 small-business clients and 26,000 vehicle dealerships. Over 80 percent of FORTUNE 500® companies and more than 90 FORTUNE 100 companies use at least one of ADP's services.  Partnering with ADP means you get solutions with the latest technology – so you can focus your limited time and resources on your business, not back-office administration."
advance-auto-parts,,BD,advance-auto-parts,"Headquartered in Roanoke, Va., Advance Auto Parts, Inc., a leading automotive aftermarket retailer of parts, accessories, batteries, and maintenance items, in the United States, serves both the do-it-yourself and professional installer markets.   The company operates over 3,900 stores in 39 states, Puerto Rico, and the Virgin Islands  and employs over  55,000 of the best Team Members in the business.  Advance Auto Parts works hard to create an environment of honesty, integrity, mutual trust and dedication. Since our founding by Arthur Taubman in 1932, the values haven’t changed."
aes,"

We are dedicated to improving lives and making a lasting difference in the communities in which our businesses operate. We are committed to a wide range of social, economic and environmental initiatives that will improve the lives of our customers and their communities; protect the environments in which we operate; empower our people and businesses; and improve long-term returns to our investors.
Our Mission

Improving lives by providing safe, reliable and sustainable energy solutions in every market we serve.
Our Vision

Our vision is to be the world’s leading sustainable power company that safely provides reliable, affordable energy. We do this by leveraging our unique electricity platforms and the knowledge of our people to provide the energy and infrastructure solutions our customers truly need. Our people share a passion to help meet the world’s current and increasing energy needs, while providing communities and countries the opportunity for economic growth due to the availability of reliable, affordable electric power.
Our Values

AES values are at the heart of our operations and we believe these values set AES apart from others in our industry. Every day, our people and businesses around the world are guided by the following core values:
PUT SAFETY FIRST

We always put safety first—for our people, contractors and communities.
ACT WITH INTEGRITY

Integrity is at the core of everything we do—how we conduct ourselves and how we interact with our stakeholders.
HONOR COMMITMENTS

We honor our commitments to our customers, teammates, communities, owners, suppliers and partners, and we encourage our businesses to make positive contributions to society.
STRIVE FOR EXCELLENCE

We strive to be the best in all that we do and to perform at world-class levels.
HAVE FUN THROUGH WORK

Work can be fun, fulfilling and exciting. We appreciate being part of a team that is making a difference and we will work to grow and strengthen our operations.
Our Culture

The energy our people bring to what they do is what powers AES. At its essence, our culture is how we channel that energy through the ways in which we work together.
WIN

We strive to win in everything we do.
GROW

We commit to growing our people, professionally and personally.
TEAM

We help each other across our business lines and our support functions.
SPEAK WITH CANDOR

We say what we think in an open and constructive way that moves us forward.
",F500,aes,"AES provides affordable and reliable energy to customers around the world through its distribution businesses and thermal and renewable power generation facilities.  With more than 30 years of experience, diverse mix of generation and utility sources provides the strength and flexibility to adapt to local and regional market needs, maximize plant efficiency and deliver reliable, affordable electricity."
aetna,,BD,aetna,"Aetna is a diversified health care benefits companies, providing individuals, employers, health care professionals, producers, and others with innovative benefits, products, and services. It is serving an estimated 46.7 million people with information and resources to help them make better decisions about their health care.

Aetna offers a broad range of traditional and consumer-directed health insurance products and related services, including medical, pharmacy, dental, behavioral health, group life, long-term care and disability plans, and medical management capabilities. Its customers include employer groups, individuals, college students, part-time and hourly workers, and more.

Aetna was founded in 1853 and is based in Hartford, C.T."
aflac,,BD,aflac,"Aflac Incorporated is the largest provider of supplemental insurance in the United States, founded in 1955 and based in Columbus, Georgia. In the United States, Aflac underwrites a wide range of insurance policies, but is perhaps more known for its payroll deduction insurance coverage, which pays cash benefits when a policyholder has a covered accident or illness. The company states it insures ""one of four Japanese households"" and is ""the largest life insurer in Japan in terms of individual insurance policies in force"". Aflac is also well known for its supplemental medical policies.  Aflac currently is the number one supplemental health provider in the U.S., followed closely by Allstate Workplace Division. However, its market share is higher than its next four competitors combined."
air-products--chemicals,,F500,air-products,"Air Products touches the lives of consumers around the globe in positive ways every day. With 18,900 employees and operations in more than 40 countries, they serve customers across a wide range of industries from food and beverage, health and personal care to energy, transportation and semiconductors. They supply a unique portfolio of atmospheric gases, process and specialty gases, performance materials, equipment and services."
airbnb,,BD,airbnb,"Airbnb is a community marketplace for people to list, discover and book unique spaces around the world through mobile phones or the internet. Whether an apartment for a night, a castle for a week, or a villa for a month, Airbnb connects people to unique travel experiences at any price point, with [over 2M listings in 34K cities and 192 countries](https://www.airbnb.com/about/about-us).  With a growing community of users, Airbnb also provides an easy way for people to monetize their extra space and showcase it to an audience of millions.   Founded in August 2008, Airbnb has acquired several of its competitors, including [Accoleo](/organization/accoleo), [CrashPadder](/organization/crashpadder), [NabeWise](/organization/nabewise), and [Localmind](/organization/localmind).  Airbnb was founded in August 2008 by [Brian Chesky](/person/brian-chesky) and [Joe Gebbia](/person/joe-gebbia), and is currently headquartered in [San Francisco, California](http://www.crunchbase.com/location/san-francisco/528f5e3c90d111115d1c2e4ff979d58e), USA."
airgas,,F500,airgas-incorporated,"Airgas, Inc., headquartered in Radnor Township, Pennsylvania, through its subsidiaries, is the largest U.S. distributor of industrial, medical and specialty gases (delivered in packaged or cylinder form), and hardgoods (welding, safety and related products)."
allergan,,BD,allergan,"Allergan, is a multi-specialty health care company focused on discovering, developing and commercializing innovative pharmaceuticals, biologics and medical devices that enable people to live life to its greatest potential  to see more clearly, move more freely, express themselves more fully."
alphabet,,F500,alphabet,"Alphabet Inc. is the holding company for Google and several Google entities, including Google X, Google Ventures, Google Capital, Calico, and its Life Sciences efforts.   On Monday, August 10th, 2015, CEO Larry Page announced the operational restructuring effort for Alphabet Inc. to replace Google Inc. as the official publicly-traded entity. He announced that all shares of Google would automatically convert into the same number of shares of Alphabet, with all of the same rights. The two classes of shares will continue to trade on Nasdaq as GOOGL and GOOG."
amazon,,BD,amazon,"Amazon is an e-commerce retailer formed originally to provide consumers with products in two segments. It offers users with merchandise and content purchased for resale from vendors and those offered by third-party sellers.   Operating in North American and International markets, Amazon provides its services through websites such as amazon.com and amazon.ca. It also enables authors, musicians, filmmakers, app developers, and others to publish and sell content via its branded websites.   Amazon also provides Kindle Direct Publishing, an online platform that allows independent authors and publishers to make their books available in the Kindle Store. In addition, it provides co-branded credit card agreements and advertising services, serves developers and enterprises through Amazon Web Services, and manufactures and sells electronic devices.   It offers Amazon Prime which is an annual membership program. It provides free shipping, streaming, and access to books to borrow and read on a Kindle device.   Amazon was founded in 1994 and is headquartered in Seattle, Washington."
american-electric-power-company,,F500,american-electric-power,"American Electric Power has a strong tradition of leadership, service and contributions to the communities we serve.AEP's Mission: Bringing comfort to our customers, supporting business and commerce, and building strong communities."
american-financial-group,,F500,american-financial-group,"American Financial Group, Inc. (NYSE:AFG) is a holding company based in Cincinnati, Ohio and has been in business for more than fifty years. Our insurance roots go back to the 1800's with the founding of Great American Insurance Company in 1872. Today, through the operations of Great American Insurance Group, AFG is engaged primarily in property and casualty insurance (""P&C""), focusing on specialized commercial products for businesses, and in the sale of traditional fixed and fixed-indexed annuities. AFG's purpose is to enable individuals and businesses to manage financial risk using insurance products and services tailored to meet their specific and ever-changing risk exposures. AFG's strategy is to allocate capital to insurance operations which management believes offer a competitive advantage or unique opportunities.   AFG's insurance operations are conducted through Great American Insurance Group. The primary objective of our P&C operations is to achieve solid underwriting profitability while providing excellent service to its agents and policyholders. The P&C operations are primarily comprised of a highly diversified group of businesses offering a wide range of specialty commercial coverages and managed by specialists in particular lines of business or customer groups. The major product lines include inland and ocean marine, workers' compensation, agricultural-related products, executive and professional liability, fidelity and surety, collateral protection, umbrella and excess liability, excess and surplus and commercial automobile. This group writes business in all 50 states primarily through independent agents and brokers."
american-international-group,,F500,american-international-group,"AIG traces its roots to 1919, when American Cornelius Vander Starr established a general insurance agency, American Asiatic Underwriters, in Shanghai, China. Since then, an enterprising spirit, ingenuity, and tenacity have built the company into one of the world’s leading insurers. Today, AIG is focused on what it has been known for since the beginning: the willingness and ability to provide insurance coverage to meet the diverse needs of its clients.  American International Group, Inc. (AIG) is a leading international insurance organization serving customers in more than 130 countries. AIG companies serve commercial, institutional, and individual customers through one of the most extensive worldwide property-casualty networks of any insurer. In addition, AIG companies are leading providers of life insurance and retirement services in the United States."
amerisourcebergen,,BD,amerisourcebergen-corporation,"AmerisourceBergen Corporation is one of the world's largest pharmaceutical services companies serving global markets with a focus on the pharmaceutical supply chain. Servicing both pharmaceutical manufacturers and healthcare providers, the Company provides drug distribution and related services designed to reduce costs and improve patient outcomes.  Their scale, their position in the healthcare industry, and the value they bring to the channel have all helped their business continue to succeed.  Headquartered in Valley Forge, PA, AmerisourceBergen has locations around the world. In the US, we handle about 20% of all of the pharmaceuticals sold and distributed throughout the country.  They strive to take costs out of the healthcare system by using their scale and efficient operations to drive value for their customers. In addition to delivering pharmaceuticals on a just-in-time basis to tens of thousands of healthcare providers every day, they provide business support and consulting services to help their customers focus on their key strength—caring for patients.  AmerisourceBergen is committed to the safety and security of the nation’s pharmaceutical supply chain. They purchase all branded and generic pharmaceuticals only directly from the product’s manufacturer, except in the rare instance that they are required to do otherwise either by the manufacturer or a government agency."
amphenol-corporation,,F500,amphenol-corporation,"Amphenol Corporation (Amphenol) is a designer, manufacturer and marketer of electrical, electronic and fiber optic connectors, interconnect systems and coaxial and high-speed specialty cable. Amphenol designs and manufactures connectors and interconnect systems, which are used primarily to conduct electrical and optical signals for a range of electronic applications. It has developed a range of connector and interconnect products for information technology and communications equipment applications, including the converging voice, video and data communications markets. The Company offers a range of interconnect products for factory automation and motion control systems, machine tools, instrumentation and medical systems, mass transportation applications and automotive safety systems and a diverse range of on-board electronics. In addition, Amphenol is a supplier of high performance, military-specification, circular environmental connectors."
anadarko,,BD,anadarko-petroleum-corporation,"Anadarko is among the world’s largest independent oil and natural gas exploration and production companies, with corporate offices in The Woodlands, Texas. Our deep and balanced portfolio of assets encompasses premier positions in major U.S. onshore shale and resource plays, and oil-focused opportunities in deepwater basins worldwide.

 Each day, we are focused on our core values of integrity and trust, servant leadership, commercial focus, people and passion and open communication in all of our business activities. We are committed to our mission of delivering a competitive and sustainable rate of return to shareholders by exploring for, acquiring and developing oil and natural gas resources vital to the world's health and welfare. At Anadarko, we directly employ more than 6,000 men and women and we strive for excellence in all that we do. We know the best vision in the world will not be realized without the right people.

 At Anadarko, we set ambitious goals and take disciplined risks to achieve them. We need individuals who will take on this challenge. We’re planning for the future and looking for exceptional people to be part of it."
anthem,,BD,anthem-3,"ANTHEM sells brands without diminishing the intelligence that created them or the intelligence of the people who buy and use them. By paying attention to both, They have increased brand desirability for large and small companies—globally, regionally and locally.   Their 5 Transactions elevate and amplify your brand’s meaning and propels its growth. Anthem’s Brand Design focus, Retail-Forward strategies and Shelf-Out amplification moves your brand in the right direction."
apache,,BD,apache,"The Apache Software Foundation provides support for the Apache community of open-source software projects. The Apache projects are characterized by a collaborative, consensus based development process, an open and pragmatic software license, and a desire to create high quality software that leads the way in its field."
apple,,BD,apple,"Apple is a multinational corporation that designs, manufactures, and markets mobile communication and media devices, personal computers, portable digital music players, and sells a variety of related software, services, peripherals, networking solutions, and third-party digital content and applications.   Apple provides many products and services, including iPhone; iPad; iPod; Mac; Apple TV; a portfolio of consumer and professional software applications; the iOS and OS X operating systems; iCloud; and accessories, service, and support offerings.    It sells its products worldwide through its retail stores, online stores, direct sales force and third-party cellular network carriers, wholesalers, retailers, and value-added resellers to the consumer and also sells third-party iPhone, iPad, Mac and iPod compatible products, including application software and accessories through its online and retail stores.   Introduced in 1984, the Macintosh was the first widely sold personal computer with a graphical user interface (GUI). That feature and others such as an improved floppy drive design and a low-cost hard drive that made data retrieval faster helped Apple cultivate a reputation for innovation.   Apple was named as the most admired company in the United States in 2008 and in the world from 2008 to 2012 by the Fortune magazine.   The company was founded by Steven Paul Jobs, Steve Wozniak, and Ronald Gerald Wayne on April 1, 1976, and is headquartered in Cupertino, California."
arrow-electronics,,BD,arrow-electronics,"Arrow Electronics, Inc. distributes a range of electronic components and enterprise computing products, services, and solutions to industrial and commercial users worldwide. The company operates in two segments, Global Components and Global Enterprise Computing Solutions. The Global Components segment offers semiconductor products and related services. It provides passive, electromechanical, and interconnect products comprising capacitors, resistors, potentiometers, power supplies, relays, switches, and connectors, as well as computing, memory, and other products. The Global Enterprise Computing Solutions segment offers enterprise and midrange computing products, services, and solutions to value-added resellers. It also offers access infrastructure, security, and virtualization software solutions, as well as midrange servers, storage, and software solutions. In addition, the company provides materials planning, design services, programming and assembly services, inventory management, and a suite of online supply chain tools. Its customers include the manufacturers of consumer and industrial equipment, telecommunication products, automotive and transportation, aerospace and defense, scientific and medical devices, and computer and office products. Arrow Electronics serves as a supply channel partner for approximately 900 suppliers and 125,000 original equipment manufacturers, contract manufacturers, and commercial customers. The company was founded in 1935 and is based in Melville, New York."
