name,about_us,source,cb_id,cb_desc
kitchenaid,,BD,kitchenaid,"Since the introduction of its legendary stand mixer in 1919 and the very first dishwasher in 1949, KitchenAid brand has built on the legacy of these icons to create a complete line of products designed for cooks. Today, the KitchenAid brand offers virtually every essential for the well-equipped kitchen with a collection that includes everything from countertop appliances to cookware, ranges to refrigerators, and whisks to wine cellars. Cook for the Cure®, the brand’s partnership with Susan G. Komen®, is now in its 13th year and has raised more than $10 million to help find a cure for breast cancer."
kraft,,BD,kraft,"Kraft Foods is a grocery conglomerate that manufactures and markets a range of food and beverage products. The company’s product categories include baking and desserts, cheese and dairy, drinks, meats, sauces and condiments, snacks, and packaged meals. 

Kraft’s principal brands and products include Maxwell House coffee, Kool-Aid drinks and MiO, Crystal Light, Kraft and Deli Deluxe processed cheese slice, Oscar Mayer cold cuts, Claussen pickles and Boca soy-based meat alternatives, JELL-O dry packaged desserts, Cool Whip whipped topping; Stove Top stuffing mix, Jet-Puffed marshmallows, Planters nuts, Bull’s-Eye barbecue sauces; and Grey Poupon premium mustards, and more.

Kraft sells its products to supermarket chains, wholesalers, supercenters, club stores, mass merchandisers, distributors, convenience stores, drug stores, gasoline stations, value stores, and other retail food outlets in the United States and Canada.

Kraft Foods was founded by James L. Kraft in 2012 and is headquartered in Northfield, Illinois."
lam-research-corporation,,F500,lam-research,"Lam Research Corporation (Lam Research) is a supplier of wafer fabrication equipment and services to the worldwide semiconductor industry. Lam Research designs, manufactures, markets, refurbish, and services semiconductor processing equipment used in the fabrication of integrated circuits. The Company’s etch and clean technologies enable customers to build integrated circuits. Its etch systems shape the microscopic conductive and dielectric layers into circuits that define a chip’s final use and function. Its Customer Support Business Group (CSBG) provides products and services to maximize installed equipment performance and operational efficiency. Its customer base includes semiconductor memory, foundry, and integrated device manufacturers (IDMs) that make DRAM, NAND, and logic devices for these products."
lansing-trade-group,,F500,lansing-trade-group,"Lansing Trade Group, LLC is an entrepreneurial trading company committed to growth in existing and emerging markets.  They deliver innovative solutions to serve their customers while rewarding their employees and equity holders."
lennar,,BD,lennar-corporation,"Lennar Corporation, founded in 1954, is headquartered in Miami, Florida and is one of the nation’s leading builders of quality homes for all generations. Lennar builds affordable, move-up and retirement homes in Communities that cater to almost any lifestyle – such as urban, golf course, Active Adult or suburban Communities."
lenovo,,IB,lenovo,"Lenovo is one of the world's leading personal technology companies, producing innovative PCs and mobile internet devices. A global Fortune 500 company, Lenovo is the world's largest PC vendor and fourth largest smartphone company.   While the Lenovo brand came into existence only in 2004, the company has a much longer history. In 1984, Legend Holdings was formed with 200,000 RMB (US$25,000) in a guard house in China. The company was incorporated in Hong Kong in 1988 and would grow to be the largest PC company in China. Legend Holdings changed its name to Lenovo in 2004 and, in 2005, acquired the former Personal Computer Division of IBM, the company that invented the PC industry in 1981.  Today, Lenovo is a US$39billion personal technology company with more than 54,000 employees (including joint ventures) in more than 60 countries serving customers in more than 160 countries. Lenovo is a global company that is incorporated and headquartered in Hong Kong, with operational centers located strategically around the world , with the largest in Beijing and Morrisville, NC. These operational centers drive Lenovo’s global and local business approach.  Lenovo has grown faster than the market for more than four years because our exceptionally engineered products are meant for those who do. Our customers use innovation to bring progress to the world, and we design and build our products with this in mind, taking inspiration from the drive and imagination of the people who make things happen. Our technology helps those who do, do better.     Whether a PC, smartphone, tablet, smart TV, server, workstation or storage, Lenovo makes the products that customers need for what we call the ""PC+ world."" Lenovo is creating real differentiation from the competition thanks to its vertically integrated end-to-end business model. This model is unique among major PC makers and is a significant source of competitive advantage, helping us to bring more innovation to market, more efficiently, and aggressively attack the PC+ opportunity.  And as Lenovo expands globally, we are establishing even deeper roots in each major market, investing not only in sales and distribution, but also in local domestic manufacturing, R&D and other high-value functions. This global reach with local excellence is enabling us to build a new kind of company - a ""global-local"" company - and positions us to more deeply implement our protect and attack strategy and build the foundation for long-term success."
leucadia-national-corporation,,F500,leucadia-national,"Leucadia National Corporation engages in manufacturing, telecommunications, land based contract oil and gas drilling, property management and services, gaming entertainment, real estate activities, medical product development, and winery operations in the United States.   Its manufacturing operations include remanufacturing dimension lumber, home center boards for large retailers, pine decking, and other specialty wood products, as well as lightweight plastic netting used in building and construction, erosion control, packaging, agricultural, carpet padding, filtration, and consumer products. The companyâ€:tm:s telecommunications business provides international prepaid phone cards and other telecommunications services in the United States.   The companyâ€:tm:s medical product development operations comprise the development of MP4OX, which is a solution of cell-free hemoglobin administered intravenously to provide oxygen delivery to oxygen deprived tissues.   Its winery operations comprise the production and sale of wines. Further, Leucadia involves in mortgage origination and mortgage servicing business, through its joint venture company, Berkadia Commercial Mortgage LLC.   The company was founded in 1854 and is based in New York, New York."
liberty-interactive-corporation,,F500,liberty-interactive-corporation,"Liberty Interactive Corporation, through its subsidiaries, is engaged in the video and on-line commerce industries in North America, Europe, and Asia. The company markets and sells various consumer products primarily through live televised shopping programs, and Websites and other interactive media, including QVC.com. It also operates Websites offering sports gear and clothing for outdoor and active individuals in various categories; sports nutrition, body building, and fitness products; costumes, accessories, décor, party supplies, and invitations; and perishable goods, including flowers, fruits, and desserts, as well as personalized gifts. In addition, Liberty Interactive Corporation provides online travel services under the TripAdvisor and daodao.com brands. The company, formerly known as Liberty Media Corporation, was founded in 1994 and is headquartered in Englewood, Colorado."
lithia-motors,,F500,lithia-motors,Lithia Auto Stores is one of America's largest automotive retailers featuring most domestic and import franchises. Our stores serve urban and rural populations throughout the Western and Midwest United States. We are focused on providing customers with an honest and simpler buying and service experience.
live-nation-entertainment,,F500,live-nation-entertainment,"Live Nation Entertainment is the world’s leading live entertainment and ecommerce company, comprised of four market leaders: Ticketmaster.com, Live Nation Concerts, Front Line Management Group and Live Nation Network.   Ticketmaster.com is the global event ticketing leader and one of the world’s top five ecommerce sites, with almost 27 million monthly unique visitors. Live Nation Concerts produces over 22,000 shows annually for more than 2,300 artists globally. Front Line is the world’s top artist management company, representing over 250 artists. These businesses power Live Nation Network, the leading provider of entertainment marketing solutions, enabling nearly 800 advertisers to tap into the 200 million consumers Live Nation delivers annually through its live event and digital platforms."
lockheed-martin,,BD,lockheed-martin,"Lockheed Martin Corporation is a global security company engaged in the research, design, development, manufacture, integration, and sustainment of advanced technology systems and products. It also provides a range of management, engineering, technical, scientific, logistic, and information services.  The Company operates in four business segments: Aeronautics, Electronic Systems, Information Systems & Global Services, and Space Systems.  In September 2008, Lockheed Martin Corporation acquired Aculight Corporation. In January 2009, it completed its acquisition of Universal Systems & Technology, Inc. (UNITECH).  In August 2009, it completed its acquisition of Gyrocam Systems LLC (Gyrocam). Gyrocam develops and supplies gyrostabilized optical surveillance systems and sustainment field services, principally to the United States military. Lockheed Martin Missiles and Fire Control, a unit of the Company's Electronic Systems business area, would manage the Gyrocam business."
lowes,,BD,lowes,"Lowe’s has been helping our customers improve the places they call home for more than 60 years. Founded in 1946, Lowe’s has grown from a small hardware store to the second-largest home improvement retailer worldwide.  Our story began in North Carolina, when Carl Buchan, part owner of the North Wilkesboro Hardware Company, envisioned creating a chain of hardware stores. He purchased the company from his brother-in-law and partner and had the foresight to anticipate a post-World War II building boom. By eliminating wholesalers and dealing directly with manufacturers, Lowe’s established a lasting reputation for low prices.  Sales grew over time and we expanded all across the country and now operate stores not only in the United States, but also in Canada and Mexico. Although times have changed since Lowe’s first opened its doors in 1946, Lowe’s values have not— the company remains committed to offering high-quality home improvement products at everyday low prices, while delivering superior customer service."
marathon-petroleum,,BD,marathon-petroleum,"Marathon Petroleum Corporation (MPC) is in the business of creating value for their shareholders through the quality products and services they provide for their customers. They strongly believe how they conduct their business is just as integral to their bottom line. As a result, they strive to always act responsibly with those who work for them, with those business partners who work with them, and in every community where they operate."
marriott,,BD,marriott-international,"Marriott International is a hospitality company with more than 3,900 properties around the world.   Marriot International opened its first hotel in 1957 and operates franchises worldwide. The company’s headquarters is based in Maryland and employees nearly 200,000 people worldwide.      The company was founded by J. Willard and Alice Marriott in 1927 by opening a root beer stand in Washington D.C."
mars,,BD,mars,"In 1911, Frank C. Mars made the first Mars candies in his Tacoma, Washington kitchen and established Mars’ first roots as a confectionery company. In the 1920s, Forrest E. Mars, Sr. joined his father in business and together they launched the MILKY WAY® bar. In 1932, Forrest, Sr. moved to the United Kingdom with a dream of building a business based on the objective of a “mutuality of benefits” for all stakeholders – this vision serves as the foundation of the Mars, Incorporated we are today.  Based in McLean, Virginia, Mars has net sales of more than $33 billion and six business segments including Petcare, Chocolate, Wrigley, Food, Drinks and Symbioscience."
marshalls,,BD,marshalls,"Marshalls, Inc., is a chain of American off-price department stores owned by TJX Companies. Marshalls has over 750 conventional stores, as well as larger stores named Marshalls Mega Store, covering 42 states and Puerto Rico. Marshalls expanded into Canada in March 2011. Marshalls is U.S.'s second largest off-price family apparel and home fashion retailer, behind its sister company, T.J. Maxx.  Source:Wikipedia[http://en.wikipedia.org/wiki/Marshalls]"
mattel,,F500,mattel,"The Mattel family of companies (Nasdaq: MAT) is the worldwide leader in the design, manufacture and marketing of toys and family products. Mattel’s portfolio of best-selling brands includes Barbie®, the most popular fashion doll ever produced, Hot Wheels®, Monster High®, American Girl®, Thomas & Friends® and Fisher-Price® brands, including Little People® and Power Wheels®, as well as a wide array of entertainment-inspired toy lines. In 2013, Mattel was named one of the ""World's Most Ethical Companies"" by Ethisphere Magazine and is also ranked No. 2 on Corporate Responsibility Magazine's ""100 Best Corporate Citizens"" list. With worldwide headquarters in El Segundo, Calif., Mattel’s companies employ nearly 30,000 people in 40 countries and territories and sell products in more than 150 nations. At Mattel, we are Creating the Future of Play."
mcdonalds,,BD,mcdonalds,"McDonald's Corporation operates and franchises McDonald's restaurants worldwide.   McDonald's Corporation operates and franchises McDonald's restaurants in the United States, Europe, the Asia-Pacific, the Middle East, Africa, Canada, and Latin America. The company's restaurants offer various food products, soft drinks, coffee, and other beverages. In response to changing consumer tastes, the company has expanded its menu to include salads, fish, wraps, smoothies, and seasoned fries.   A McDonald's restaurant is operated by either a franchisee, an affiliate, or the actual corporation itself. The McDonald's Corporation revenues come from the rent, royalties, and fees paid by the franchisees as well as sales in company-operated restaurants.   The company was founded in 1940 and is based in Oak Brook, Illinois."
mclane-company,,BD,mclane,"McLane Company, Inc. is a $48 billion supply chain services leader, providing grocery and foodservice supply chain solutions for convenience stores, mass merchants, drug stores and chain restaurants throughout the United States. McLane, through McLane Grocery, McLane Foodservice and wholly owned subsidiary, Meadowbrook Meat Company, Inc., (MBM), operates 80 distribution centers across the U.S. and one of the nation’s largest private fleets.  The company buys, sells and delivers more than 50,000 different consumer products to nearly 90,000 locations across the U.S. In addition, McLane provides alcoholic beverage distribution through its wholly owned subsidiary, Empire Distributors, Inc. McLane is a wholly owned unit of Berkshire Hathaway Inc. (NYSE: BRK) and employs more than 20,000 teammates."
metlife,,BD,metlife,"MetLife, Inc. (MetLife) is a provider of insurance, employee benefits and financial services, with operations throughout the United States and the regions of Latin America, Asia Pacific and Europe, Middle East and India (EMEI). The Company provides a variety of insurance and financial services products, including life, dental, disability and long-term care insurance, various annuity products, and auto and home insurance. Within the United States, it also provides a range of savings and mortgage banking products. The Company's segments include Insurance Products (group life, individual life and non-medical health insurance products), Retirement Products (individual and institutional annuity products), Corporate Benefit Funding (pension closeouts, structured settlements and other benefit funding solutions), Auto and Home segment, International, as well as Banking, Corporate and Other.   MetLife, Inc. is the holding corporation for the Metropolitan Life Insurance Company, or MetLife, for short, and its affiliates. MetLife is among the largest global providers of insurance, annuities, and employee benefit programs, with 90 million customers in over 60 countries. The firm was founded on March 24, 1868.  On January 6, 1915, MetLife completed the mutualization process, changing from a stock life insurance company owned by individuals to a mutual company operating without external shareholders and for the benefit of policyholders. The company went public in 2000. Through its subsidiaries and affiliates, MetLife holds leading market positions in the United States, Japan, Latin America, Asia’s Pacific region, Europe, and the Middle East. MetLife is the largest life insurer in the United States and serves 90 of the largest Fortune 500 companies. The company’s principal offices are located at 1095 Avenue of the Americas in Midtown Manhattan, New York City, though it retains some executive offices and its boardroom in the MetLife Building, located at 200 Park Avenue, New York City, which it sold in 2005."
mgm-resorts-international,,F500,mgm-resorts-international,"MGM Resorts International develops, builds and operates unique destination resorts designed to provide a total resort experience, including first-class accommodations and dining, world-class entertainment, state-of-the-art meeting and convention facilities, and high-quality retail and gaming experiences."
michaels,,BD,michaels-stores,"Michaels Stores is North America's largest specialty retailer of arts, crafts, framing, floral, wall dÃ©cor and seasonal merchandise for the hobbyist and do-it-yourself home decorator. As of October 2, 2010, the Company owns and operates 1,041 Michaels stores in 49 states and Canada, and 142 Aaron Brothers stores."
minute-maid,,BD,minute-maid,"Minute Maid is a product line of beverages, usually associated with lemonade, orange juice or soft drinks of many kinds, including Hi-C."
mohawk-industries,,F500,mohawk-industries,"Mohawk Industries is a leading global flooring manufacturer that creates products to enhance residential and commercial spaces around the world. Mohawk’s vertically integrated manufacturing and distribution processes provide competitive advantages in the production of carpet, rugs, ceramic tile, laminate, wood, stone, luxury vinyl tile and sheet vinyl. Their industry-leading innovation has yielded products and technologies that differentiate their brands in the marketplace and satisfy all flooring related remodeling and new construction requirements. Their brands are among the most recognized in the industry and include American Olean, Bigelow, Daltile, Durkan, Karastan, Kerama Marazzi, Lees, Marazzi, Mohawk, Pergo, Quick-Step and Unilin. During the past decade, Mohawk has transformed its business from an American carpet manufacturer into the world’s largest flooring company with operations in Australia, Brazil, Canada, China, Europe, India, Malaysia, Mexico, New Zealand, Russia and the United States."
moodys,,BD,moodys,"Moody’s Corporation provides credit ratings, research, tools and analysis that contribute to transparent and integrated financial markets.  Moody’s is the parent company of Moody’s Investors Service. This helps to provide credit ratings and research covering debt instruments and securities. It is also a parent company of Moody’s Analytics. This offers leading-edge software, advisory services and research for credit and economic analysis and financial risk management.  Moody’s has about 6,800 employees, and has presences in 28 countries. Raymond McDaniel is currently Moody’s President and Chief Executive Officer, and Mark E. Almeida is the President of Moody’s Analytics.  The founder of Moody’s, John Moody & Company published Moody’s Manual of Industrial and Miscellaneous Securities in 1900, the company’s founding year."
murphy-usa,,F500,murphy-usa,"Murphy USA is the place hard-working people count on for big savings on quality gas, so they can go farther down the road. Their team works hard to provide Their customers with the quickest and friendliest service, as well as the best value.  Their principles keep us focused on that mission.   Murphy USA is passionate about giving back to the communities where Their customers - and team members - live and work.  At Their stations and Their home office, They roll up Their sleeves to help others in hundreds of community events each year.  Their team members lend a hand wherever they see a need.  From local charities to national organizations, They value partnering with others to make a difference.  Their sponsorship of the LPGA Symetra Tour's Murphy USA golf tournament, which supports female athletes, is a shining example of Their drive to give back.  In good times and challenging moments, Murphy USA is there.  They work behind the scenes year-round to make sure that They are ready should a natural disaster occur.  Their neighbors can count on us to be among the first wave of support with water and the basic necessities of life.  Their goal is to open Their local stations as quickly as possible to support Their customers and first responders."
navient-corporation,,F500,navient-corporation,"Navient Corporation holds the portfolio of education loans insured or guaranteed under the Federal Family Education Loan Program (FFELP Loans), as well as the portfolio of private education loans (Private Education Loans). FFELP Loans are insured or guaranteed by state or not-for-profit agencies and are also protected by contractual rights to recovery from the United States pursuant to guaranty agreements among the United States Department of Education(ED), and these agencies. The Company operates in four segments: Consumer Lending, Business Services, FFELP Loans and Other. At December 31, 2013, 84% of its FFELP Loan portfolio was funded to term with non-recourse, long-term securitization debt. The Company also sold its Campus Solution business and its 529 college-savings plan administration business in 2013 in connection with better aligning its core business. The results of both of these businesses are reported in discontinued operations for all periods presented"
navistar-international-corporation,,F500,navistar,"Navistar International Corp. is a holding company whose individual units provide integrated and best-in-class transportation solutions. Based in Warrenville, Ill., the company produces InternationalÂ® brand commercial trucks, mid-range diesel engines and IC brand school buses, and Workhorse brand chassis for motor homes and step vans. It is a private-label designer and manufacturer of diesel engines for the pickup truck, van and SUV markets. The company also provides truck and diesel engine parts and service. A wholly owned subsidiary offers financing services."
ncr-corporation,,F500,ncr,"NCR Corporation (NCR) is a technology company, which provides products and services, which enable businesses to connect, interact and transact with their customers. NCR’s portfolio of self-service and assisted-service solutions serve customers in the financial services, retail, hospitality, travel and gaming and entertainment industries and include automated teller machines (ATMs). The Company operates in fits segments: Financial Services, Retail Solutions, Entertainment, and Emerging Industries. On August 24, 2011, NCR completed the acquisition of Radiant Systems Inc. (Radiant), a provider of multichannel point-of-sale and managed hosted service solutions to the hospitality and specialty retail industries. On December 23, 2011, it sold its healthcare solutions business, including its MediKiosk patient access software, NCR Payment Manager, Patient Portal, Patient Tracking, Physician Referral and eForms software solutions, to Quadramed Corporation."
