name,about_us,source,cb_id,cb_desc
charles-schwab,,BD,charles-schwab,"From day one, Chuck Schwab knew investing could be different – that investors deserved better prices, better access and better service. And for the past four decades, the firm that bears his name has been doing just that.  They pioneered discount brokerage. They created an innovative and convenient way to invest through a supermarket of no-load, no-transaction-fee mutual funds. They led the way in online investing. They helped thousands of independent advisors serve their clients. And they disrupted the 401(k) industry with a plan offer designed to lower costs, simplify investing and help workers better prepare for retirement.  A lot has changed in 40 years, but a lot has stayed the same. Charles Schwab is still striving to champion every client’s goals with passion and integrity. They’re still breaking down barriers – and occasionally tilting at windmills – to discover a better way to invest.  Charles Schwab focuses on the needs of individual investors, whether they’re serving them directly, through an employer-sponsored retirement or equity plan, or through independent investment advisors.  Seeing through clients’ eyes has always been the Schwab way. Today, approximately 14,000 employees share a passion for helping millions of investors achieve their financial goals. By working together and listening thoughtfully to their clients, they’ve been able to make investing more accessible, affordable and understandable."
charter-communications,,F500,charter-communications,"Charter, founded in 1993, created a customer service-oriented company that has grown and evolved on many levels over the past two decades. Charter's growth was achieved through acquisitions of cable properties and the subsequent increase of customers in those communities, as well as development and launch of new products and services. Charter became a publicly-traded company on NASDAQ in 1999 and has been a Fortune 500 company since 2001.  A leading broadband communications company and the fourth-largest cable operator in the United States, Charter today employs approximately 23,000 and provides services to more than 6 million customers in 28 states. Headquartered in Stamford, CT, the company is focused on integrating the highest-quality service with clearly superior entertainment and communications products. Over the years, billions have been invested in the communities Charter serves through infrastructure upgrades to deliver video, high-speed Internet and phone service to homes and businesses."
chase,,BD,chase-corporation,"Chase Corporation is a leading manufacturer of protective materials for high reliability applications.  For over 60 years they have made a material difference by developing high performance Industrial Coatings, Tapes, Adhesives and Sealants that are marketed under brand names recognized as the most trusted in their respective industries."
chevrolet,,BD,chevrolet,"Chevrolet is leading the way with the most vehicles in its line up offering the available built-in OnStar 4G LTE Wi-Fi hotspot, allowing passengers the ability to seamlessly connect their smart devices and vehicles to the internet.  The available OnStar 4G LTE Wi-Fi hotspot provides a better in-vehicle experience than your smartphone. The stronger signal delivers a fast, reliable connection. It’s automatically on after initial setup and ready to connect to your mobile devices.   The available OnStar 4G LTE Wi-Fi hotspot is the most powerful and reliable AT&T built-in data connection available from any car company. Which means you can easily connect on the go."
chs,,F500,chs-community-health-systems,"Community Health Systems Inc. is a Fortune 500 company based in Franklin, Tennessee. It is the largest non-urban provider of general hospital healthcare services in the United States in terms of number of acute care facilities. As of January 2014, it operates 206 hospitals in 29 states."
chubb,,BD,chubb-corporation,"For more than 130 years, the Chubb Group of Insurance Companies has been delivering exceptional property and casualty insurance products and services to businesses and individuals around the world.  Today, they are the 12th largest property and casualty insurer in the United States and have a worldwide network of some 120 offices in 26 countries staffed by 10,200 employees. The Chubb Corporation reported $52.2 billion in assets and $13.6 billion in revenues in 2012. According to Fortune magazine, Chubb is the 202nd largest U.S.-based corporation.  They have emerged as a leader in the insurance industry not only on the basis of their size or their longevity. They consistently strive to build lasting relationships with their customers and 8,500 independent agents and brokers, and they aim to be the best at what they do by delivering unparalleled service and innovative, scalable and specialized products backed by financial strength and third-party endorsements."
cigna,,BD,cigna,"CIGNA Corporation operates as a health service company in the United States.   The company's subsidiaries are providers of health care and related benefits, the majority of which are offered through the workplace, including health care products and services, such as  - Medical Coverages  - Pharmacy behavioral health. - Dental benefits and disease management. - Group Disability.  - Life and accident insurance.   In addition, the company has an international operation that offers life, accident and supplemental health insurance products and international health care products and services to businesses and individuals in selected markets."
cincinnati-financial-corporation,,F500,cincinnati-financial,"In 1950, four independent insurance agents formed The Cincinnati Insurance Company. Their dedication and commitment to the independent agency system remains their mission as they keep agents at the center of their identity.   They believe that locally based agents have the relationships in their communities that lead to satisfied, loyal policyholders. They complement the service you receive from your local agent by employing local field representatives who are supported by associates at their headquarters in Fairfield, Ohio. These empowered field representatives take action to respond to agents and policyholders quickly and personally."
cintas-corp,,BD,cintas,"Headquartered in Cincinnati, OH, Cintas Corporation provides highly specialized services to businesses of all types throughout North America.  Cintas operates more than 420 facilities in the U.S. and Canada, including four manufacturing plants and eight distribution centers that employ more than 30,000 people.  Company revenues were $3.5 billion in fiscal year 2010. Net income for the year was $216 million, and earnings per diluted share were $1.49.  Cintas was founded by Richard T. Farmer, Chairman Emeritus. Scott Farmer was appointed Chief Executive Officer in 2003 and Bob Kohlhepp serves as Chairman of the Board."
cisco,,BD,cisco,"Cognitive Security is a technology company focused on applying artificial intelligence techniques to detect advanced cyber threats. Their solution integrates a range of sophisticated technologies to identify and analyze key threats, both external and internal to a customer through advanced behavioral analysis of real-time data."
comcast-corporation,,F500,comcast,"CMCSA is a type of publicly traded stocks of Comcast, a mass media and communications company that provides cable, entertainment, and communication products and services.     It is a class A common stock traded in NASDAQ. CMCSA offers voting rights of .1323 votes per share."
corning,,BD,corning,"Corning Incorporated is the world leader in specialty glass and ceramics.  Drawing on more than 150 years of materials science and process engineering knowledge, Corning creates and makes keystone components that enable high-technology systems for consumer electronics, mobile emissions control, telecommunications and life sciences.  Learn more about how Corning collaborates closely with customers across these industries to turn what were once only possibilities into breakthrough realities."
costco,,BD,costco,"Costco is a membership warehouse club, dedicated to bringing their members the best possible prices on quality brand-name merchandise. With hundreds of locations worldwide, Costco provides a wide selection of merchandise, plus the convenience of specialty departments and exclusive member services, all designed to make your shopping experience a pleasurable one.  The company's first location, opened in 1976 under the Price Club name, was in a converted airplane hangar on Morena Boulevard in San Diego. Originally serving only small businesses, the company found it could achieve far greater buying clout by also serving a selected audience of non-business members. With that change, the growth of the warehouse club industry was off and running.  In 1983, the first Costco warehouse location was opened in Seattle. Costco became the first company ever to grow from zero to $3 billion in sales in less than six years. When Costco and Price Club merged in 1993, the combined company, operating under the name PriceCostco, had 206 locations generating $16 billion in annual sales."
csc,,BD,csc,"CSC is a leading global IT services company. CSC is a global leader in providing technology-enabled business solutions and services. CSC has helped its clients manage and profit from every major wave of change in IT since its formation in 1959.  CSC provides innovative solutions for customers around the world by applying leading technologies and CSC's own advanced capabilities. These include systems design and integration, IT and business process outsourcing (BPO), applications software development, Web and application hosting, and management and technology consulting."
csx,,BD,csx-corporation,"CSX Corporation, together with its subsidiaries based in Jacksonville, Florida, is one of the nation's leading transportation suppliers. The company’s rail and intermodal businesses provide rail-based transportation services including traditional rail service and the transport of intermodal containers and trailers.  CSX serves major markets in the eastern United States and has access to over 70 ocean, river and lake port terminals along the Atlantic and Gulf Coasts, the Mississippi River, the Great Lakes and the St. Lawrence Seaway. The company also has access to Pacific ports through alliances with western railroads.  CSX moves a broad portfolio of products across the country in a way that minimizes the effect on the environment, takes traffic off an already congested highway system, and minimizes fuel consumption and transportation costs."
cummins,,BD,cummins,"Cummins Inc. is a diesel engine manufacturer. The Company designs, manufactures, distributes and services diesel and natural gas engines, electric power generation systems and engine-related component products, including filtration, exhaust aftertreatment, fuel systems, fuel systems, controls systems, air handling systems and electric power.   The Company sells its products to original equipment manufacturers (OEMs), distributors and other customers worldwide. It serves its customers through a network of more than 600 company owned and independent distributor locations and more than 6,500 dealer locations in more than 190 countries and territories.   It has four segments: Engine, Power Generation, Components and Distribution.   In April 2011, the Company sold its exhaust business to Global Tube. In July 2012, the Company acquired the emission control assets of Hilite International in Marktheidenfeld. The Hilite assets are part of Cummins Emission Solution (CES)."
danaher,,BD,danaher,"Danaher Corporation (Danaher) designs, manufactures and markets professional, medical, industrial and commercial products and services. The Company’s research and development, manufacturing, sales, distribution, service and administrative facilities are located in more than 50 countries. It operates in five segments: Test & Measurement; Environmental; Life Sciences & Diagnostics; Dental; and Industrial Technologies. In April 2011, the Company sold its Pacific Scientific Aerospace (PSA) business.   On June 30, 2011, the Company acquired Beckman Coulter, Inc. (Beckman Coulter). In January 2012, the Company sold its Accu-Sort businesses. In February 2012, the Company sold its Kollmorgen Electro-Optical (KEO) business. During the year ended December 31, 2011, the Company acquired EskoArtwork, On February 6, 2012, L-3 Communications Holdings, Inc. acquired Kollmorgen Electro-Optical unit of the Company."
davita-healthcar,,BD,davita-healthcare-partners,"DaVita® and HealthCare Partners® have joined forces to become one of the nation's largest and most innovative healthcare communities. The merged entity, DaVita HealthCare Partners Inc., leverages a shared passion for and commitment to clinical excellence and improving patients' health and quality of life.  As an operating division of DaVita HealthCare PartnersSM, DaVita is focused on setting worldwide standards for clinical, social and operational practices in kidney care. From raising awareness of chronic kidney disease to providing industry-leading, no-cost diet- and health-management resources to people diagnosed with it, DaVita will continue its pursuit to keep people off dialysis as long as possible—and to improve access to treatment and quality of life for those who do need dialysis"
dean-foods-company,,F500,dean-foods,"Dean Foods Company, together with its subsidiaries, operates as a food and beverage company in the United States. The company operates in two segments, DSD Dairy and WhiteWave-Morningstar.  Dean Foods Company was founded in 1925. It was formerly known as Suiza Foods Corporation and changed its name to Dean Foods Company in 2001."
dell,,BD,dell,Dell is transforming computing and providing high quality solutions that empower people to do more all over the world.
deloitte,,BD,deloitte,"“Deloitte” is the brand under which tens of thousands of dedicated professionals in independent firms throughout the world collaborate to provide audit, consulting, financial advisory, risk management, tax and related services to select clients.  These firms are members of Deloitte Touche Tohmatsu Limited, a UK private company limited by guarantee (“DTTL”). Each DTTL member firm provides services in particular geographic areas and is subject to the laws and professional regulations of the particular country or countries in which it operates.   Each DTTL member firm is structured in accordance with national laws, regulations, customary practice, and other factors, and may secure the provision of professional services in its territory through subsidiaries, affiliates, and other related entities.  Not every DTTL member firm provides all services, and certain services may not be available to attest clients under the rules and regulations of public accounting.   DTTL and each DTTL member firm are legally separate and independent entities, which cannot obligate each other.  DTTL and each DTTL member firm are liable only for their own acts and omissions, and not those of each other.  DTTL (also referred to as “Deloitte Global”) does not provide services to clients.   The DTTL member firm in the United States is Deloitte LLP. Deloitte’s offices in New York have over 5,000 professionals in Audit, Advisory, Financial Advisory Services, Tax, and Consulting. Deloitte’s U.S. headquarters at 30 Rockefeller Plaza in Manhattan was awarded the U.S. Green Building Council’s Leadership in Energy and Environmental Design (LEED) Certification at the Gold level for commercial interiors in 2013. Deloitte designed its headquarters as a next generation workplace, bringing to life the organization’s commitment to cutting-edge technology, open and flexible work settings and conference and training facilities."
directv,,BD,directv,"DIRECTV (NASDAQ: DTV) is the world's most popular video service delivering state-of-the-art technology, unmatched programming, the most comprehensive sports packages available and industry leading customer service to its more than 25 million customers in the U.S. and Latin America. In the U.S., DIRECTV offers its 18.56 million customers more than 130 HD channels and Dolby-Digital 5.1 theater-quality sound (when available), access to exclusive sports programming such as NFL SUNDAY TICKET, award winning technology like its DIRECTV DVR Scheduler and higher customer satisfaction than the leading cable companies for nine years running. DIRECTV Latin America, through its subsidiaries and affiliated companies in Brazil, Mexico, Argentina, Venezuela, Colombia, and other Latin American countries, leads the pay-TV category in technology, programming and service, delivering an unrivaled digital television experience to 6.5 million customers. DIRECTV sports and entertainment properties include three Regional Sports Networks (Northwest, Rocky Mountain and Pittsburgh) as well as a 65 percent interest in Game Show Network. For the most up-to-date information on DIRECTV, please call 1-800-DIRECTV or visit directv.com."
dollar-tree,,BD,dollar-tree-stores-inc,"Dollar Tree is a chain of discount stores that carries a variety of merchandise including housewares, glassware, dinnerware, cleaning supplies, candy, snacks, food, health and beauty, toys, gifts, gift bags and wrap, party supplies, stationery, craft supplies, teaching supplies, books, seasonal décor, and more for $1 or less."
dover-corporation,,F500,dover,"Dover Corporation (Dover) owns and operates a global portfolio of manufacturing companies providing components and equipment, specialty systems and support services for a variety of applications in the industrial products, engineered systems, fluid management and electronic technologies markets. The Company operates in four business segments: Industrial Products, Engineered Systems, Fluid Management and Electronic Technologies. The products designed, manufactured, assembled and/or serviced by the Company includes material handling equipment, mobile equipment related products, engineered products, product identification related products, energy market production and distribution products, fluid solution products, and electronic technology equipment and devices/components. In January 2011, the Company acquired Harbison Fischer, Inc., a designer and manufacturer of down-hole rod pumps and related products."
dte-energy-co,,BD,dte-energy,DTE Energy provides gas & electric utility services to MI homes and businesses.
eastman-chemical-company,,F500,eastman-chemical-company,"Eastman Chemical Company (Eastman) is a global specialty chemicals company that produces a range of advanced materials, chemicals and fibers that are found in products people use every day. Eastman has over 40 manufacturing sites in 16 countries and equity interests in joint ventures that supply chemicals, plastics, and fibers products to customers throughout the world. Eastman has a portfolio of specialty businesses that hold positions and provide products that enhance performance in a variety of end markets such as transportation, building and construction, and consumables. Eastman management believes that the Company's end-market diversity is a source of strength, as these markets are benefiting from longer-term global trends such as energy efficiency, a rising middle class in emerging economies, and increased health and wellness. On July 2, 2012, the Company completed its acquisition of Solutia Inc. (Solutia)."
emcor-group,,F500,emcor-group,"EMCOR Group, Inc. (NYSE: EME) is a Fortune 500 company and global leader in mechanical and electrical construction, energy infrastructure, LEED construction, design/build, life safety, and facilities services.  As a leading provider of critical infrastructure systems, EMCOR gives life to new structures and sustains life in existing ones via high-quality commercial construction services and facilities services which include planning, installing, operating, maintaining and protecting the sophisticated systems that create facility environments. This includes electrical, mechanical, lighting, HVAC systems, heating and air conditioning, facilities security, fire protection, and energy power generation systems — in virtually every sector of the economy, and for a diverse range of businesses, organizations and government, EMCOR is there.  EMCOR represents a rare combination of broad reach with local execution, combining the strength of an industry leader with the knowledge and care of 170+ locations. The 27,000+ skilled employees of EMCOR have ranked the company, in the eyes of leading business publications, among the ""World's Most Admired"" and ""Best Managed."""
emerson,,BD,emerson,"Emerson is where technology and engineering come together to create solutions for the benefit of our customers, driven without compromise for a world in action."
energy-future-holdings-corp,,F500,energy-future-holdings,"Energy Future Holdings Corp. is a Dallas-based, privately held energy company with a portfolio of competitive and regulated energy companies. These businesses serve the high-growth Texas electricity market, which is one of world’s largest and among the nation’s most successful competitive markets."
entergy,,BD,entergy-corporation,"Entergy Corporation is an integrated energy company engaged primarily in electric power production and retail distribution operations. Entergy owns and operates power plants with approximately 30,000 megawatts of electric generating capacity, including nearly 10,000 megawatts of nuclear power."
envision-healthcare-holdings,,F500,envision-healthcare,"Envision Healthcare is a Healthcare Benefits Manager that specializes in the creation, development and implementation of Consumer Driven Health Care plans. Our goal is to change the way healthcare is financed and delivered in America. We do this by providing employers and employees the tools and information to make wise healthcare choices."
eog-resources,,BD,eog-resources,"EOG Resources is a Fortune 500 company with its headquarters in the Heritage Plaza building in downtown Houston, Texas. The company is one of the largest independent oil and natural gas companies in the United States with proven reserves in the United States, Canada, Trinidad and Tobago, the United Kingdom, and China. EOG Resources, Inc. is listed on the New York Stock Exchange and is traded under the ticker symbol ""EOG""."
equinix,,BD,equinix,"Equinix provides global data center services that ensure the vitality of the information-driven world. Global enterprises, content and financial companies, and nearly 600 network service providers rely upon Equinix's insight and expertise to protect and connect their most valued information assets.   Currently, Equinix operates 90 International Business Exchange™ (IBX®) data centers across 35 major metropolitan areas in 11 countries in North America, Europe and Asia-Pacific."
expedia.com,,BD,expedia,"Expedia is an online travel agency. It enables users to access a wide ranges of services. It books airline tickets, hotel reservations, car rentals, cruises, vacation packages, and various attractions and services via the world wide web and telephone travel agents. Its primary web businesses include Expedia.com, Hotels.com, Hotwire.com, and Egencia.com. It launched Tripadvisor in 2011. It also offers services for corporate travel and travel services in Europe and Asia.   Expedia also operates internationally with sites in Canada, the United Kingdom, Germany, France, Italy, Spain, the Netherlands, Norway, Sweden, Denmark, Australia, Japan, and China. It is done through its investment in eLong."
expeditors-international-of-washington,,F500,expeditors-international,"Expeditors is a global logistics company headquartered in Seattle, Washington. As a Fortune 500 company, we employ over 14,600 trained professionals in a worldwide network of over 250 locations across six continents. Expeditors satisfies the increasingly sophisticated needs of international trade through customized solutions and seamless, integrated information systems. Our services include the consolidation and forwarding of air or ocean freight, customs brokerage, vendor consolidation, cargo insurance, time-definite transportation, order management, warehousing, distribution and customized logistics solutions.  At Expeditors, we pride ourselves on being a solutions-based organization and take time to understand each customer's individual business needs. As a non-asset based organization, we have considerable flexibility when managing customers' supply chains. Due to our relationships with local suppliers and global air and ocean partners, we can provide customers with the best routing and pricing options. Our comprehensive, flexible spectrum of services is supported by leading-edge information technology that provides a high level of visibility from end to end.  To maintain consistent quality and customer service across the globe, Expeditors has regional headquarters located in London, Dubai, Shanghai and Singapore."
express-scripts,,BD,express-scripts,"Express Scripts makes the use of prescription drugs safer and more affordable for tens of millions of consumers through thousands of employers, government, union and health plans."
