name,include,url,brand_identity,source,cb_id,cb_desc,logo_file,logo_url
autozone,2,http://www.autozone.com/,AutoZone is the leading retailer and a leading distributor of automotive replacement parts and accessories in the U.S.AutoZone is built on a culture of philanthropy which does all they can to meet the needs of the present while protecting our future.,BD,autozone,"For over 30 years, AutoZone has been committed to providing the best auto parts, prices and customer service in the automotive aftermarket industry. At AutoZone.com they focuses on putting customers first, according to their highly dedicated crew of skilled staff who specialize in various essential car and machine products. Their staff is dedicated to bringing only the best quality of automotive parts of customers and clients all over the world.  Without any doubt, today, AutoZone.com is the leading retailer and a leading distributor of automotive replacement parts and accessories in the United States.",autozone.jpg,http://www.columbia.edu/~rtd2118/logos/autozone.jpg
barnes-noble,2,http://www.barnesandnoble.com/,"With so many titles, it is vital to give customers an easy way to find precisely the books they are looking for. Our search engine enables customers to locate books by title, author, or keyword in a few seconds at most. Customers with a general idea of what they want can use our Browse pages to sift through hundreds of categories to find exactly the right book. To further assist users, we offer descriptions and reviews, and our See Inside program lets customers read excerpts from tens of thousands of titles. We also offer editor recommendations and customer reviews on hundreds of thousands of titles.",F500,barnes-noble,"Barnes & Noble is a multi-channel distribution platform that provides access to trade books, textbooks, magazines, newspapers, and other content. It operates as a content, commerce, and technology company.     Barnes & Noble's main business is the sale of trade books, mass-market paperbacks, children's books, bargain books, magazines, gift, cafe products and services, music, and movies direct to customers. As of January 2009, the company operated 778 bookstores and a website.     Barnes & Noble was founded in 1917 by [Leonard Riggio](http://www.crunchbase.com/person/leonard-riggio). It is headquartered in New York, N.Y.",barnes-noble.png,http://www.columbia.edu/~rtd2118/logos/barnes-noble.png
berkshire-hathaway,2,http://www.berkshirehathaway.com/,"Berkshire Hathaway HomeServices is a real estate brokerage franchise network designed for today's real estate market. From first time home buyers to high-end residential markets to middle market communities to commercial real estate, our franchisees are down to earth, nimble and local experts. This network of members and agents wouldn't be a part of the Berkshire Hathaway HomeServices family if they weren't.",BD,berkshire,"Berkshire Group is a real estate investment management company distinguished by over four decades in the U.S. real estate markets, an integrated investment and operating platform, an experienced team, and an opportunistic approach to finding value on behalf of institutional investment clients, including pension funds, endowments and foundations, in the U.S. and around the world.",berkshire-hathaway.jpg,http://www.columbia.edu/~rtd2118/logos/berkshire-hathaway.jpg
bmw,2,http://www.bmw.com/,"The BMW Group sets trends in production technology and sustainability as an innovation leader with an intelligent material mix, a technological shift towards digitalisation and resource-efficient production. At the same time, flexibility and continuous optimisation of value chains ensure competitiveness.    Long-term thinking and responsible action are the basis of economic success. Ecological and social sustainability, comprehensive product responsibility and a clear commitment to conserving resources are therefore an integral part of our strategy. With Efficient Dynamics, the BMW Group consistently implements the principle of sustainable mobility and is steadily reducing its vehicles' fuel consumption and emissions.",IB,bmw,"Bayerische Motoren Werke AG (BMW), is a German automobile and motorcycle manufacturing company. Founded in 1916, it is known for its performance and luxury vehicles. It owns and produces the MINI brand, and is the parent company of Rolls-Royce Motor Cars.  As a global company, the BMW Group operates 25 production and assembly facilities in 14 countries and has a global sales network in more than 140 countries.",bmw.png,http://www.columbia.edu/~rtd2118/logos/bmw.png
boeing,2,http://www.boeing.com/,"Boeing is the world's largest aerospace company and leading manufacturer of commercial jetliners and defense, space and security systems. As America's biggest manufacturing exporter, the company supports airlines and U.S. and allied government customers in more than 150 countries. Boeing products and tailored services include commercial and military aircraft, satellites, weapons, electronic and defense systems, launch systems, advanced information and communication systems, and performance-based logistics and training.    Boeing has a long tradition of aerospace leadership and innovation. The company continues to expand its product line and services to meet emerging customer needs. Its broad range of capabilities includes creating new, more efficient members of its commercial airplane family; designing, building and integrating military platforms and defense systems; creating advanced technology solutions; and arranging innovative customer-financing options.    With corporate offices in Chicago, Boeing employs approximately 150,000 people across the United States and in more than 65 countries. This represents one of the most diverse, talented and innovative workforces anywhere. Our enterprise also leverages the talents of hundreds of thousands more skilled people working for Boeing suppliers worldwide.    Boeing is organized into two business units: Commercial Airplanes and Defense, Space & Security. Supporting these units are Boeing Capital Corporation, a global provider of financing solutions; Shared Services Group, which provides a broad range of services to Boeing worldwide; and Boeing Engineering, Operations & Technology, which helps develop, acquire, apply and protect innovative technologies and processes.",BD,the-boeing-company,"The Boeing Company is an American multinational corporation that designs, manufactures and sells fixed-wing aircraft, rotorcraft, rockets and satellites and provides leasing and product support services. Boeing is among the largest global aircraft manufacturers, is the second-largest aerospace & defense contractor in the world based on 2012 revenue and is the US' largest exporter by dollar value. Boeing stock is a component of the Dow Jones Industrial Average.  The Boeing Company's corporate headquarters are located in Chicago and the company is led by Chairman and CEO James McNerney. Boeing is organized into five primary divisions: Boeing Commercial Airplanes (BCA), Boeing Defense, Space & Security (BDS), Engineering, Operations & Technology, Boeing Capital and Boeing Shared Services Group.  Boeing is the world's largest aerospace company and leading manufacturer of commercial jetliners and defense, space and security systems. A top U.S. exporter, the company supports airlines and U.S. and allied government customers in 150 countries. Boeing products and tailored services include commercial and military aircraft, satellites, weapons, electronic and defense systems, launch systems, advanced information and communication systems, and performance-based logistics and training.  Boeing has a long tradition of aerospace leadership and innovation. The company continues to expand its product line and services to meet emerging customer needs. Its broad range of capabilities includes creating new, more efficient members of its commercial airplane family; integrating military platforms, defense systems and the warfighter through network-enabled solutions; creating advanced technology solutions; and arranging innovative customer-financing options. With corporate offices in Chicago, Boeing employs more than 170,000 people across the United States and in 70 countries. This represents one of the most diverse, talented and innovative workforces anywhere. More than 140,000 employees hold college degrees -- including nearly 35,000 advanced degrees -- in virtually every business and technical field from approximately 2,700 colleges and universities worldwide. Our enterprise also leverages the talents of hundreds of thousands more skilled people working for Boeing suppliers worldwide.  Boeing is organized into two business units: Boeing Commercial Airplanes and Boeing Defense, Space & Security. Supporting these units are Boeing Capital Corporation, a global provider of financing solutions; the Shared Services Group, which provides a broad range of services to Boeing worldwide; and Boeing Engineering, Operations & Technology, which helps develop, acquire, apply and protect innovative technologies and processes.",boeing.jpg,http://www.columbia.edu/~rtd2118/logos/boeing.jpg