"name","include","url","brand_identity","source","cb_id","cb_desc","logo_file","logo_url"
"becton-dickinson-and-company",0,"http://www.bd.com/us/","BD is a global medical technology company that is advancing the world of health by improving medical discovery, diagnostics and the delivery of care. BD leads in patient and health care worker safety and the technologies that enable medical research and clinical laboratories. The company provides innovative solutions that help advance medical research and genomics, enhance the diagnosis of infectious disease and cancer, improve medication management, promote infection prevention, equip surgical and interventional procedures and support the management of diabetes BD is a global medical technology company that is advancing the world of health by improving medical discovery, diagnostics and the delivery of care. BD leads in patient and health care worker safety and the technologies that enable medical research and clinical laboratories. The company provides innovative solutions that help advance medical research and genomics, enhance the diagnosis of infectious disease and cancer, improve medication management, promote infection prevention, equip surgical and interventional procedures and support the management of diabetes","F500","becton-dickinson","BD is a leading medical technology company that partners with customers and stakeholders to address many of the world's most pressing and evolving health needs. Our innovative solutions are focused on improving drug delivery, enhancing the diagnosis of infectious diseases and cancers, supporting the management of diabetes and advancing cellular research. We are nearly 30,000 associates in 50 countries who strive to fulfill our purpose of Helping all people live healthy lives by advancing the quality, accessibility, safety and affordability of healthcare around the world.","becton-dickinson-and-company.png","http://www.columbia.edu/~rtd2118/logos/becton-dickinson-and-company.png"
"bed-bath-and-beyond",0,"https://www.bedbathandbeyond.com/store/static/CorporateResponsibilityReport","Founded in 1971, Bed Bath & Beyond Inc. and subsidiaries (the  _Company ) is a retailer selling a wide assortment of domestics merchandise and home furnishings which operates under the names Bed Bath & Beyond, Christmas Tree Shops, Christmas Tree Shops andThat! or andThat!, Harmon, Harmon Face Values or Face Values, buybuy BABY and World Market, Cost Plus World Market or Cost Plus. Customers can purchase products from the Company either in-store, online or through a mobile device. The Company has the developing ability to have customer purchases picked up in-store or shipped direct to the customer from the Company's distribution facilities, stores or vendors. In addition, the Company operates Of a Kind, an e-commerce website that features specially commissioned, limited edition items from emerging fashion and home designers; One Kings Lane, an authority in home dcor and design offering a unique collection of select home goods, designer and vintage items; and PersonalizationMall.com, an industry-leading online retailer of personalized products. The Company also operates Linen Holdings, a provider of a variety of textile products, amenities and other goods to institutional customers in the hospitality, cruise line, healthcare and other industries. Additionally, the Company is a partner in a joint venture which operates retail stores in Mexico under the name Bed Bath & Beyond.    The Company sells a wide assortment of domestics merchandise and home furnishings. Domestics merchandise includes categories such as bed linens and related items, bath items and kitchen textiles. Home furnishings include categories such as kitchen and tabletop items, fine tabletop, basic housewares, general home furnishings, consumables and certain juvenile products.    The Company strives to do more for and with its customers by: offering an extensive breadth, depth and differentiated assortment of merchandise at the right value; presenting merchandise in a distinctive manner designed to maximize customer convenience and reinforce customer perception of a wide selection; and providing excellent customer service, including new ideas and solutions. The Company continues to grow, differentiate and leverage its assortment across all channels, concepts and countries in which it operates, to better engage with its customers wherever, whenever and however they express their life interests and travel through their life stages. Through its growing analytic capabilities and omnichannel marketing approaches, the Company strives to more efficiently and effectively understand and satisfy its customers' needs. The Company is also enhancing its ability to achieve this objective through an ongoing commitment to world class information and interactive technology, comprehensive analytics and targeted marketing and communications. Founded in 1971, Bed Bath & Beyond Inc. and subsidiaries (the  _Company ) is a retailer selling a wide assortment of domestics merchandise and home furnishings which operates under the names Bed Bath & Beyond, Christmas Tree Shops, Christmas Tree Shops andThat! or andThat!, Harmon, Harmon Face Values or Face Values, buybuy BABY and World Market, Cost Plus World Market or Cost Plus. Customers can purchase products from the Company either in-store, online or through a mobile device. The Company has the developing ability to have customer purchases picked up in-store or shipped direct to the customer from the Company's distribution facilities, stores or vendors. In addition, the Company operates Of a Kind, an e-commerce website that features specially commissioned, limited edition items from emerging fashion and home designers; One Kings Lane, an authority in home dcor and design offering a unique collection of select home goods, designer and vintage items; and PersonalizationMall.com, an industry-leading online retailer of personalized products. The Company also operates Linen Holdings, a provider of a variety of textile products, amenities and other goods to institutional customers in the hospitality, cruise line, healthcare and other industries. Additionally, the Company is a partner in a joint venture which operates retail stores in Mexico under the name Bed Bath & Beyond.    The Company sells a wide assortment of domestics merchandise and home furnishings. Domestics merchandise includes categories such as bed linens and related items, bath items and kitchen textiles. Home furnishings include categories such as kitchen and tabletop items, fine tabletop, basic housewares, general home furnishings, consumables and certain juvenile products.    The Company strives to do more for and with its customers by: offering an extensive breadth, depth and differentiated assortment of merchandise at the right value; presenting merchandise in a distinctive manner designed to maximize customer convenience and reinforce customer perception of a wide selection; and providing excellent customer service, including new ideas and solutions. The Company continues to grow, differentiate and leverage its assortment across all channels, concepts and countries in which it operates, to better engage with its customers wherever, whenever and however they express their life interests and travel through their life stages. Through its growing analytic capabilities and omnichannel marketing approaches, the Company strives to more efficiently and effectively understand and satisfy its customers' needs. The Company is also enhancing its ability to achieve this objective through an ongoing commitment to world class information and interactive technology, comprehensive analytics and targeted marketing and communications.","BD","bed-bath-beyond","Bed Bath & Beyond Inc. and subsidiaries (the Company) operates a chain of retail stores under the names of Bed Bath & Beyond, Christmas Tree Shops, Harmon, Harmon Face Values and buybuy BABY. The Company is also a partner in a joint venture which operates retail stores in Mexico under the name Home & More. The Company sells a wide assortment of domestics merchandise and home furnishings. Domestics merchandise includes categories such as bed linens and related items, bath items and kitchen textiles. Home furnishings include categories such as kitchen and tabletop items, fine tabletop, basic housewares, general home furnishings, consumables and certain juvenile products. Additionally, the Company includes Linen Holdings, a business-to-business distributor of a variety of textile products, amenities and other goods to customers in the hospitality, cruise line, food service, healthcare and other industries. As of May 26, 2012, the Company had a total of 1,180 stores, including 995 Bed Bath & Beyond stores in all 50 states, the District of Columbia, Puerto Rico and Canada, 72 Christmas Tree Shops stores, 68 buybuy BABY stores and 45 stores under the names of Harmon or Harmon Face Values. Shares of Bed Bath & Beyond Inc. are traded on NASDAQ under the symbol BBBY and are included in the Standard and Poor's 500 and Global 1200 Indices and the NASDAQ-100 Index. The Company is counted among the Fortune 500 and the Forbes 2000.","bed-bath-and-beyond.jpg","http://www.columbia.edu/~rtd2118/logos/bed-bath-and-beyond.jpg"
"best-buy",0,"http://www.bestbuy.com/","Best Buy is a leading provider of technology products, services and solutions. The company offers expert service at an unbeatable price more than 1.5 billion times a year to the consumers, small business owners and educators who visit our stores, engage with Geek Squad Agents or use BestBuy.com or the Best Buy app. The company has operations in the U.S. where more than 70 percent of the population lives within 15 minutes of a Best Buy store, as well as in Canada and Mexico, where Best Buy has a physical and online presence. Best Buy is a leading provider of technology products, services and solutions. The company offers expert service at an unbeatable price more than 1.5 billion times a year to the consumers, small business owners and educators who visit our stores, engage with Geek Squad Agents or use BestBuy.com or the Best Buy app. The company has operations in the U.S. where more than 70 percent of the population lives within 15 minutes of a Best Buy store, as well as in Canada and Mexico, where Best Buy has a physical and online presence.","BD","bestbuy","Best Buy is a multinational retailer of technology and entertainment products and services offering consumer electronics and more. Its family of brands and partnerships includes brands such as Best Buy, Audiovisions, Future Shop, Geek Squad, Jiangsu Five Star, Magnolia Audio Video, Pacific Sales, and Cowboom. The company is comprised of over 155,000 employees, and they apply their talents to bring the benefits of its brands to the lives of its customers through retail locations, multiple call centers, and websites, in-home solutions, product delivery, and activities in its community.  Best Buy's product portfolio includes consumer electronic video products such as televisions, digital cameras and accessories, digital camcorders, and DVD players; audio products comprising MP3 players, navigation products, home theater audio systems, and components; mobile electronics home office products comprising notebook and desktop computers, monitors, mobile phones and related subscription service commissions, hard drives, and networking equipment; entertainment software products such as video gaming hardware and software, DVDs, CDs, digital downloads, and computer software; and appliances, such as kitchen appliances, plumbing fixtures, snacks, and beverages.  Best Buy provides its users with service contracts; extended warranties; product repair; broadband voice, data, and information technology services; and delivers and installs home theater, mobile audio, and appliances. In addition, the company engages in online retailing through BestBuy.com, BestBuy.ca, BestBuy.com.cn, Espanol.BestBuy.com, and BestBuyMobile.com; CarphoneWarehouse.com; Five-Star.cn; FutureShop.ca; GeekSquad.com and GeekSquad.ca; MagnoliaAV.com; Napster.com; PacificSales.com; PhoneHouse.com; and Speakeasy.net.  Best Buy was founded in 1966 and is headquartered in Litchfield, M.N. with additional offices in the United States, Canada, Mexico, China, and Europe.","best-buy.jpg","http://www.columbia.edu/~rtd2118/logos/best-buy.jpg"
"big-lots",0,"http://www.biglots.com/","Our Mission: Surprises in Every Aisle, Every Day    People expect something special when they walk into Big Lots -- and that's exactly what they get. Big Lots offers brand-name merchandise priced 20 to 40 percent below most discount retailers and up to 70 percent below traditional retailers. Customers love our unique products and once-in-a-lifetime deals. We also carry brand-name foods, home furnishings, attractive and affordable furniture, seasonal merchandise, and hundreds of everyday items customers want and need.    Big Lots employs over 35,000 associates across the U.S. and operates approximately 1,400 stores in 47 states. Our stock is traded on the New York Stock Exchange under the symbol BIG.    Our business was founded on the belief that everyone loves a great deal. This guiding principle is at the heart of our mission: Surprises in every aisle, every day! Our customers are savvy about shopping, practical about savings, and thrilled by great merchandise, brands, and prices. Our Mission: Surprises in Every Aisle, Every Day    People expect something special when they walk into Big Lots -- and that's exactly what they get. Big Lots offers brand-name merchandise priced 20 to 40 percent below most discount retailers and up to 70 percent below traditional retailers. Customers love our unique products and once-in-a-lifetime deals. We also carry brand-name foods, home furnishings, attractive and affordable furniture, seasonal merchandise, and hundreds of everyday items customers want and need.    Big Lots employs over 35,000 associates across the U.S. and operates approximately 1,400 stores in 47 states. Our stock is traded on the New York Stock Exchange under the symbol BIG.    Our business was founded on the belief that everyone loves a great deal. This guiding principle is at the heart of our mission: Surprises in every aisle, every day! Our customers are savvy about shopping, practical about savings, and thrilled by great merchandise, brands, and prices.","F500","big-lots","Big Lots, Inc., through its wholly owned subsidiaries, is a North America's closeout retailer. At January 28, 2012, the Company operated a total of 1,533 stores in two countries: the United States and Canada. The Company operates in two segments: U.S. and Canada. The merchandising categories include Consumables, Furniture, Home, Seasonal, Play n' Wear, and Hardlines & Other. The Consumables category includes the food, health and beauty, plastics, paper, chemical, and pet departments. The Furniture category includes the upholstery, mattresses, ready-to-assemble, and case goods departments. The Home category includes the domestics, stationery, and home decorative departments. The Seasonal category includes the lawn and garden, Christmas, summer, and other holiday departments. The Play n' Wear category includes the electronics, toys, jewelry, infant accessories, and apparel departments. The Hardlines & Other category includes the appliances, tools, paint, and home maintenance departments.","big-lots.png","http://www.columbia.edu/~rtd2118/logos/big-lots.png"
"biogen-idec-inc",0,"https://www.biogen.com/","One of the pioneers in biotechnology, Biogen today has the leading portfolio of medicines to treat multiple sclerosis (MS), has the first and only approved treatment for spinal muscular atrophy (SMA) and is at the forefront of research into new medicines for neurological and neurodegenerative conditions. Led by world-class research and development, Biogen uses novel science and leading-edge technologies to create, commercialize, and manufacture transformative therapies for patients with few or no treatment options.    For more than two decades, Biogen has transformed the understanding and treatment of MS. Today, our research is focused on developing new MS treatments with the goal of repairing damage caused by the disease  _ and ultimately working to find a cure.    We are further applying our expertise to solve some of the most challenging and complex diseases in neurology, including Alzheimer's disease, Parkinson's disease, and amyotrophic lateral sclerosis (ALS). The pace of discovery and innovation in neuroscience is accelerating rapidly, bringing the promise of incredible advances to patients. As we help lead this transformative period in neuroscience, Biogen is driving a deeper understanding of disease biology and working to develop potentially life-changing treatments for the people suffering from these conditions. One of the pioneers in biotechnology, Biogen today has the leading portfolio of medicines to treat multiple sclerosis (MS), has the first and only approved treatment for spinal muscular atrophy (SMA) and is at the forefront of research into new medicines for neurological and neurodegenerative conditions. Led by world-class research and development, Biogen uses novel science and leading-edge technologies to create, commercialize, and manufacture transformative therapies for patients with few or no treatment options.    For more than two decades, Biogen has transformed the understanding and treatment of MS. Today, our research is focused on developing new MS treatments with the goal of repairing damage caused by the disease  _ and ultimately working to find a cure.    We are further applying our expertise to solve some of the most challenging and complex diseases in neurology, including Alzheimer's disease, Parkinson's disease, and amyotrophic lateral sclerosis (ALS). The pace of discovery and innovation in neuroscience is accelerating rapidly, bringing the promise of incredible advances to patients. As we help lead this transformative period in neuroscience, Biogen is driving a deeper understanding of disease biology and working to develop potentially life-changing treatments for the people suffering from these conditions.","BD","biogen-idec","Biogen Idec uses cutting-edge science to discover, develop, manufacture and market biological products for the treatment of serious diseases with a focus on neurological disorders.   Founded in 1978, Biogen Idec is the world's oldest independent biotechnology company. Patients worldwide benefit from its leading multiple sclerosis therapies, and the company generates more than $4 billion in annual revenues.","biogen-idec-inc.jpg","http://www.columbia.edu/~rtd2118/logos/biogen-idec-inc.jpg"
"black-and-decker",0,"http://www.blackanddecker.com/","Since our earliest days as a small Baltimore machine shop, BLACK+DECKER has remained steadfastly focused on customer needs. Learn more about how we've earned our reputation for quality, ingenuity and value. Since our earliest days as a small Baltimore machine shop, BLACK+DECKER has remained steadfastly focused on customer needs. Learn more about how we've earned our reputation for quality, ingenuity and value.","BD","black-decker","BLACK+DECKER provides consumers with products that help make everyday living and working easier and more efficient. We've been doing it for 100 years, and we plan to continue doing so, with the same passion and innovation.","black-and-decker.jpg","http://www.columbia.edu/~rtd2118/logos/black-and-decker.jpg"
"blackrock",0,"https://www.blackrock.com/investing","BlackRock is trusted to manage more money than any other investment manager in the world, helping millions of people and the world's biggest institutions and governments reach their investing goals. We work only for our clients. Our promise is to give them insight into what to do with their money, providing products and services that can help them build a better financial future. BlackRock is trusted to manage more money than any other investment manager in the world, helping millions of people and the world's biggest institutions and governments reach their investing goals. We work only for our clients. Our promise is to give them insight into what to do with their money, providing products and services that can help them build a better financial future.","BD","blackrock","BlackRock's business is investing on behalf of our clients, from large institutions to parents and grandparents, doctors and teachers who entrust their savings to us. We work only for our clientsperiod. Our promise is to offer them the clearest thinking about what to do with their money and the products and services they need to secure a better financial future.  That's why investors of all kinds have made us the world's largest asset manager, entrusting us with trillions of dollars, and it's why companies, institutions and global governments come to us for help meeting their biggest financial challenges.  Important disclosures: http://www.blackrock.com/corporate/en-us/compliance/social-media-guidelines","blackrock.jpg","http://www.columbia.edu/~rtd2118/logos/blackrock.jpg"
"blackstone",0,"https://www.blackstone.com/","Founded in 2007, the Blackstone Charitable Foundation is committed to inspiring entrepreneurship globally. By leveraging the resources and intellectual capital of Blackstone, the Foundation empowers entrepreneurs, generates job growth, and supports the communities in which we live and work.    We believe that intellectual capital is critical to providing innovative solutions and, ultimately, having a positive economic impact. Over the years, we have been fortunate to attract some of the most talented professionals in our industry. They stay to build rewarding careers because of our entrepreneurial spirit, a commitment to our people and the high expectation for excellence. Our people are our most valuable asset  _ they are skilled problem solvers that believe challenges can be opportunities.    Everything we do is guided by this set of principles which define our character and culture; they have been at the core of Blackstone since its inception. These enduring qualities are the shared convictions that we bring to our professional and personal conduct  _ they are a fundamental strength of our business. Founded in 2007, the Blackstone Charitable Foundation is committed to inspiring entrepreneurship globally. By leveraging the resources and intellectual capital of Blackstone, the Foundation empowers entrepreneurs, generates job growth, and supports the communities in which we live and work.    We believe that intellectual capital is critical to providing innovative solutions and, ultimately, having a positive economic impact. Over the years, we have been fortunate to attract some of the most talented professionals in our industry. They stay to build rewarding careers because of our entrepreneurial spirit, a commitment to our people and the high expectation for excellence. Our people are our most valuable asset  _ they are skilled problem solvers that believe challenges can be opportunities.    Everything we do is guided by this set of principles which define our character and culture; they have been at the core of Blackstone since its inception. These enduring qualities are the shared convictions that we bring to our professional and personal conduct  _ they are a fundamental strength of our business.","BD","blackstone-technology-group","Blackstone Technology Group provides software and services that create high throughput computing environments. Blackstone helps customers speed time-to-market by designing and optimizing infrastructures for high user productivity, low administrative burden, and low ownership cost.  Blackstone accomplishes these goals with Consultants who have  expertise in the applications and process methodologies, as well as in the design and optimization of large-scale, high-throughput computing environments; and Software products that simplify usage and administration of the environment, as well as maximize computing throughput and architecture scalability.","blackstone.jpg","http://www.columbia.edu/~rtd2118/logos/blackstone.jpg"
"bnsf-railway",0,"http://www.bnsf.com/","Today's BNSF Railway is the product of nearly 400 different railroad lines that merged or were acquired over the course of 160 years.    While many different railroads combined to form BNSF, the people who worked at those railroads shared many traits. The people who built BNSF were -- and continue to be -- a unique breed, blending the forward-thinking of dreamers with the pragmatism of results-oriented business leaders. This heritage played a central role in settling and growing the American West, and today, BNSF continues to have a significant impact in meeting the needs of shippers and serving the economy Today's BNSF Railway is the product of nearly 400 different railroad lines that merged or were acquired over the course of 160 years.    While many different railroads combined to form BNSF, the people who worked at those railroads shared many traits. The people who built BNSF were -- and continue to be -- a unique breed, blending the forward-thinking of dreamers with the pragmatism of results-oriented business leaders. This heritage played a central role in settling and growing the American West, and today, BNSF continues to have a significant impact in meeting the needs of shippers and serving the economy","BD","bnsf-railway-company","BNSF is a critical link that connects consumers with the global marketplace. For more than 160 years, BNSF has played a vital role in building and sustaining this nation's economy.","bnsf-railway.jpg","http://www.columbia.edu/~rtd2118/logos/bnsf-railway.jpg"
