"name","include","url","brand_identity","source","cb_id","cb_desc","logo_file","logo_url"
"ameren-corporation",0,"https://www.ameren.com","Ameren Corporation is an American power company created December 31, 1997 by the merger of Missouri's Union Electric Company (formerly NYSE: UEP) and the neighboring Central Illinois Public Service Company (CIPSCO Inc. holding, formerly NYSE: CIP).[4] It is now a holding company for several power companies and energy companies. The company is based in St. Louis, Missouri, serving 2.4 million electric, and 900,000 natural gas customers across 64,000 square miles Ameren Corporation is an American power company created December 31, 1997 by the merger of Missouri's Union Electric Company (formerly NYSE: UEP) and the neighboring Central Illinois Public Service Company (CIPSCO Inc. holding, formerly NYSE: CIP).[4] It is now a holding company for several power companies and energy companies. The company is based in St. Louis, Missouri, serving 2.4 million electric, and 900,000 natural gas customers across 64,000 square miles","F500","ameren","Ameren Corporation (Ameren) is a utility holding company. The Company's principal subsidiaries are Union Electric Company (Ameren Missouri) and Ameren Illinois Company (Ameren Illinois). The Company's segments include Ameren Missouri and Ameren Illinois. Ameren Missouri operates a rate-regulated electric generation, transmission and distribution business, and a rate-regulated natural gas transmission and distribution business in Missouri. Ameren Illinois operates a rate-regulated electric and natural gas transmission and distribution business in Illinois. AER consists of non-rate-regulated operations, including Ameren Energy Generating Company (Genco), AmerenEnergy Resources Generating Company (AERG) and Ameren Energy Marketing Company (Marketing Company). In December 2013, the Company announced that it has completed the divestiture of its merchant generation business, formerly known as Ameren Energy Resources Company, LLC (AER).","ameren-corporation.png","http://www.columbia.edu/~rtd2118/logos/ameren-corporation.png"
"american-airlines",0,"https://www.aa.com/","On April 15, 1926, Charles Lindbergh flew the first American Airlines flight  _ carrying U.S. mail from St. Louis, Missouri, to Chicago, Illinois. After 8 years of mail routes, the airline began to form into what it is today. American founder C.R. Smith worked with Donald Douglas to create the DC-3; a plane that changed the entire airline industry, switching revenue sources from mail to passengers.    Together with regional partner American Eagle, we offer an average of nearly 6,700 flights daily to 350 destinations in 50 countries. We're a founding member of the oneworld alliance, whose members and members-elect offer nearly 14,250 flights daily to 1,000 destinations in 150 countries. On April 15, 1926, Charles Lindbergh flew the first American Airlines flight  _ carrying U.S. mail from St. Louis, Missouri, to Chicago, Illinois. After 8 years of mail routes, the airline began to form into what it is today. American founder C.R. Smith worked with Donald Douglas to create the DC-3; a plane that changed the entire airline industry, switching revenue sources from mail to passengers.    Together with regional partner American Eagle, we offer an average of nearly 6,700 flights daily to 350 destinations in 50 countries. We're a founding member of the oneworld alliance, whose members and members-elect offer nearly 14,250 flights daily to 1,000 destinations in 150 countries.","BD","american-airlines","American Airlines focuses on providing an exceptional travel experience across the globe, serving more than 260 airports in more than 50 countries and territories. American's fleet of nearly 900 aircraft fly more than 3,500 daily flights worldwide from hubs in Chicago, Dallas/Fort Worth, Los Angeles, Miami and New York.","american-airlines.jpg","http://www.columbia.edu/~rtd2118/logos/american-airlines.jpg"
"american-electric-power-company",0,"https://www.aep.com/","American Electric Power has a strong tradition of leadership, service and contributions to the communities we serve.    AEP's Mission: Together, with our customers, we are redefining the future of energy and developing innovative solutions that power communities and improve lives.    AEP's Vision: Powering a new and brighter future for our customers and communities. American Electric Power has a strong tradition of leadership, service and contributions to the communities we serve.    AEP's Mission: Together, with our customers, we are redefining the future of energy and developing innovative solutions that power communities and improve lives.    AEP's Vision: Powering a new and brighter future for our customers and communities.","F500","american-electric-power","American Electric Power has a strong tradition of leadership, service and contributions to the communities we serve.AEP's Mission: Bringing comfort to our customers, supporting business and commerce, and building strong communities.","american-electric-power-company.png","http://www.columbia.edu/~rtd2118/logos/american-electric-power-company.png"
"american-express",0,"https://www.americanexpress.com/","Each day, American Express makes it easier, safer and more rewarding for consumers and businesses to purchase the things they need    The American Express cardand for merchants to sell their goods and services. An engine of commerce, American Express provides innovative payment, travel and expense management solutions for individuals and businesses of all sizes. Most of all, we help our customers realize their dreams and aspirations through industry-leading benefits, access to unique experiences, business-building insights, and global customer care. We enable our customers to do more and achieve more. Each day, American Express makes it easier, safer and more rewarding for consumers and businesses to purchase the things they need    The American Express cardand for merchants to sell their goods and services. An engine of commerce, American Express provides innovative payment, travel and expense management solutions for individuals and businesses of all sizes. Most of all, we help our customers realize their dreams and aspirations through industry-leading benefits, access to unique experiences, business-building insights, and global customer care. We enable our customers to do more and achieve more.","BD","americanexpress","American Express is a global financial services company best known for its credit card, charge card and traveler's cheque businesses.","american-express.png","http://www.columbia.edu/~rtd2118/logos/american-express.png"
"american-family-insurance-group",0,"https://www.amfam.com/","Our Mission  To inspire, protect and restore your dreams. Because we believe a dream is the most valuable thing you'll ever own.    Our Values  Employee-focused, customer-driven. Our commitment to you is to be innovative, caring, agile, trustworthy, transparent, and above all else, passionate. Our Mission  To inspire, protect and restore your dreams. Because we believe a dream is the most valuable thing you'll ever own.    Our Values  Employee-focused, customer-driven. Our commitment to you is to be innovative, caring, agile, trustworthy, transparent, and above all else, passionate.","F500","american-family-insurance","For more than 85 years, American Family Insurance has built its reputation on sound principles. We strive to provide you industry-leading service, exceptional claims experience and products that build long-term relationships. This is accomplished by treating policyholders fairly in a helpful and caring way and making it easy and convenient to work with us. We know our customers like family. American Family Insurance thrives by conducting its business in accordance with the highest ethical standards and the law at all times. Integrity is part of our culture and always has been. The reputation we enjoy and trust-based relationships we have built with our customers are determined by the example set by management and the character and good judgment exercised at all levels of our organization. Its a way of doing business that our customers have come to expect from us and a standard that we continue to live up to.","american-family-insurance-group.png","http://www.columbia.edu/~rtd2118/logos/american-family-insurance-group.png"
"american-financial-group",0,"http://www.afginc.com/","With the power of generations behind it, AFG grows and changes with discipline and integrity. We're proud of who we are, where we've been and where we're going. Our industry is changing and we continue to change as well. We strive to continue to build value for our shareholders, provide quality products and service to our customers and offer a rewarding work environment for our employees    American Financial Group is committed to strong and effective corporate governance. ""Integrity in All We Do"" is one of our core values. We believe that strong principles and the highest standards of ethical conduct are critical to securing investor trust and confidence. With the power of generations behind it, AFG grows and changes with discipline and integrity. We're proud of who we are, where we've been and where we're going. Our industry is changing and we continue to change as well. We strive to continue to build value for our shareholders, provide quality products and service to our customers and offer a rewarding work environment for our employees    American Financial Group is committed to strong and effective corporate governance. ""Integrity in All We Do"" is one of our core values. We believe that strong principles and the highest standards of ethical conduct are critical to securing investor trust and confidence.","F500","american-financial-group","American Financial Group, Inc. (NYSE:AFG) is a holding company based in Cincinnati, Ohio and has been in business for more than fifty years. Our insurance roots go back to the 1800's with the founding of Great American Insurance Company in 1872. Today, through the operations of Great American Insurance Group, AFG is engaged primarily in property and casualty insurance (""P&C""), focusing on specialized commercial products for businesses, and in the sale of traditional fixed and fixed-indexed annuities. AFG's purpose is to enable individuals and businesses to manage financial risk using insurance products and services tailored to meet their specific and ever-changing risk exposures. AFG's strategy is to allocate capital to insurance operations which management believes offer a competitive advantage or unique opportunities.   AFG's insurance operations are conducted through Great American Insurance Group. The primary objective of our P&C operations is to achieve solid underwriting profitability while providing excellent service to its agents and policyholders. The P&C operations are primarily comprised of a highly diversified group of businesses offering a wide range of specialty commercial coverages and managed by specialists in particular lines of business or customer groups. The major product lines include inland and ocean marine, workers' compensation, agricultural-related products, executive and professional liability, fidelity and surety, collateral protection, umbrella and excess liability, excess and surplus and commercial automobile. This group writes business in all 50 states primarily through independent agents and brokers.","american-financial-group.png","http://www.columbia.edu/~rtd2118/logos/american-financial-group.png"
"ameriprise-financial",0,"https://www.ameriprise.com","Integrity has been a core value since we were founded by John Tappan in 1894. It's how, through panics, recessions, the Great Depression and the recent Great Recession, we've grown into a global financial leader. We've never taken a bailout. Never lost our focus on our clients. That's who we are.    We have more than $800 billion in assets under management and administration.1  We maintain leadership positions in each of our core business segments: Advice & Wealth Management, Asset Management, Annuities and Protection.2  We have more financial planning clients than any other firm.3 Integrity has been a core value since we were founded by John Tappan in 1894. It's how, through panics, recessions, the Great Depression and the recent Great Recession, we've grown into a global financial leader. We've never taken a bailout. Never lost our focus on our clients. That's who we are.    We have more than $800 billion in assets under management and administration.1  We maintain leadership positions in each of our core business segments: Advice & Wealth Management, Asset Management, Annuities and Protection.2  We have more financial planning clients than any other firm.3","BD","ameriprise-financial","John Tappan founded Ameriprise Financial with a singular vision, to help ordinary Americans achieve their financial dreams and feel confident about their futures. Throughout their long history, they have remained steadfast to this vision of putting their clients' needs first, always.  Over the years, they've helped millions of people invest billions of dollars for what's important to them. Today, they are America's leader in financial planning* and a leading global financial institution, with more than $655 billion in assets under management and administration.","ameriprise-financial.png","http://www.columbia.edu/~rtd2118/logos/ameriprise-financial.png"
"amerisourcebergen",0,"http://www.amerisourcebergen.com/","AmerisourceBergen is driving innovative partnerships with global manufacturers, providers and pharmacies to improve product access and efficiency throughout the healthcare supply chain. As part of the largest global generics purchasing organization, the leading specialty pharmaceutical services provider and the partner with more community and health system pharmacy relationships than any other--we're well positioned to help you capitalize on the dynamic changes in healthcare. From product commercialization and distribution to pharmacy, provider and manufacturer solutions, we're working with you every day to enhance patient care.    Our company's mission is to improve our patients' lives by delivering innovative services and solutions that drive quality and efficiency in healthcare. As we live out this mission, we continually seek to integrate sustainability and social responsibility principles into our daily actions.    AmerisourceBergen: Where knowledge, reach and partnership shape healthcare delivery. AmerisourceBergen is driving innovative partnerships with global manufacturers, providers and pharmacies to improve product access and efficiency throughout the healthcare supply chain. As part of the largest global generics purchasing organization, the leading specialty pharmaceutical services provider and the partner with more community and health system pharmacy relationships than any other--we're well positioned to help you capitalize on the dynamic changes in healthcare. From product commercialization and distribution to pharmacy, provider and manufacturer solutions, we're working with you every day to enhance patient care.    Our company's mission is to improve our patients' lives by delivering innovative services and solutions that drive quality and efficiency in healthcare. As we live out this mission, we continually seek to integrate sustainability and social responsibility principles into our daily actions.    AmerisourceBergen: Where knowledge, reach and partnership shape healthcare delivery.","BD","amerisourcebergen-corporation","AmerisourceBergen Corporation is one of the world's largest pharmaceutical services companies serving global markets with a focus on the pharmaceutical supply chain. Servicing both pharmaceutical manufacturers and healthcare providers, the Company provides drug distribution and related services designed to reduce costs and improve patient outcomes.  Their scale, their position in the healthcare industry, and the value they bring to the channel have all helped their business continue to succeed.  Headquartered in Valley Forge, PA, AmerisourceBergen has locations around the world. In the US, we handle about 20% of all of the pharmaceuticals sold and distributed throughout the country.  They strive to take costs out of the healthcare system by using their scale and efficient operations to drive value for their customers. In addition to delivering pharmaceuticals on a just-in-time basis to tens of thousands of healthcare providers every day, they provide business support and consulting services to help their customers focus on their key strength   caring for patients.  AmerisourceBergen is committed to the safety and security of the nation's pharmaceutical supply chain. They purchase all branded and generic pharmaceuticals only directly from the product's manufacturer, except in the rare instance that they are required to do otherwise either by the manufacturer or a government agency.","amerisourcebergen.jpg","http://www.columbia.edu/~rtd2118/logos/amerisourcebergen.jpg"
"amgen",0,"http://www.amgen.com/","Amgen is one of the world's leading biotechnology companies. Amgen is a values-based company, deeply rooted in science and innovation to transform new ideas and discoveries into medicines for patients with serious illnesses. Amgen is one of the world's leading biotechnology companies. Amgen is a values-based company, deeply rooted in science and innovation to transform new ideas and discoveries into medicines for patients with serious illnesses.","BD","amgen-2","Amgen is one of the world's leading biotechnology companies. Amgen is a values-based company, deeply rooted in science and innovation to transform new ideas and discoveries into medicines for patients with serious illnesses.","amgen.jpg","http://www.columbia.edu/~rtd2118/logos/amgen.jpg"
"amphenol-corporation",0,"https://www.amphenol.com/","Amphenol is one of the largest manufacturers of interconnect products in the world. The Company designs, manufactures and markets electrical, electronic and fiber optic connectors, coaxial and flat-ribbon cable, and interconnect systems.    The primary end markets for the Company's products are communications and information processing markets, including cable television, cellular telephone and data communication and information processing systems; aerospace and military electronics; and automotive, rail and other transportation and industrial applications. Amphenol is one of the largest manufacturers of interconnect products in the world. The Company designs, manufactures and markets electrical, electronic and fiber optic connectors, coaxial and flat-ribbon cable, and interconnect systems.    The primary end markets for the Company's products are communications and information processing markets, including cable television, cellular telephone and data communication and information processing systems; aerospace and military electronics; and automotive, rail and other transportation and industrial applications.","F500","amphenol-corporation","Amphenol Corporation (Amphenol) is a designer, manufacturer and marketer of electrical, electronic and fiber optic connectors, interconnect systems and coaxial and high-speed specialty cable. Amphenol designs and manufactures connectors and interconnect systems, which are used primarily to conduct electrical and optical signals for a range of electronic applications. It has developed a range of connector and interconnect products for information technology and communications equipment applications, including the converging voice, video and data communications markets. The Company offers a range of interconnect products for factory automation and motion control systems, machine tools, instrumentation and medical systems, mass transportation applications and automotive safety systems and a diverse range of on-board electronics. In addition, Amphenol is a supplier of high performance, military-specification, circular environmental connectors.","amphenol-corporation.png","http://www.columbia.edu/~rtd2118/logos/amphenol-corporation.png"
"anadarko",0,"http://www.anadarko.com/","Anadarko's mission is to deliver a competitive and sustainable rate of return to shareholders by developing, acquiring and exploring for oil and natural gas resources vital to the world's health and welfare.    We view sustainability as integral to continuing to fulfill our corporate mission. Anadarko is committed to operating in a sustainable manner and proactively working with the communities where we operate on a daily basis around the world. As Anadarko employees, we work in our core areas of operations, and we live there too. We recognize our obligation to protect our environment, public health and our communities, while finding and producing the vital oil and natural gas resources that fuel modern life.     We achieve sustainability by living our core values of integrity and trust, servant leadership, open communication, people and passion, and commercial focus, all of which guide our activities and decisions. Anadarko's mission is to deliver a competitive and sustainable rate of return to shareholders by developing, acquiring and exploring for oil and natural gas resources vital to the world's health and welfare.    We view sustainability as integral to continuing to fulfill our corporate mission. Anadarko is committed to operating in a sustainable manner and proactively working with the communities where we operate on a daily basis around the world. As Anadarko employees, we work in our core areas of operations, and we live there too. We recognize our obligation to protect our environment, public health and our communities, while finding and producing the vital oil and natural gas resources that fuel modern life.     We achieve sustainability by living our core values of integrity and trust, servant leadership, open communication, people and passion, and commercial focus, all of which guide our activities and decisions.","BD","anadarko-petroleum-corporation","Anadarko is among the world's largest independent oil and natural gas exploration and production companies, with corporate offices in The Woodlands, Texas. Our deep and balanced portfolio of assets encompasses premier positions in major U.S. onshore shale and resource plays, and oil-focused opportunities in deepwater basins worldwide.   Each day, we are focused on our core values of integrity and trust, servant leadership, commercial focus, people and passion and open communication in all of our business activities. We are committed to our mission of delivering a competitive and sustainable rate of return to shareholders by exploring for, acquiring and developing oil and natural gas resources vital to the world's health and welfare. At Anadarko, we directly employ more than 6,000 men and women and we strive for excellence in all that we do. We know the best vision in the world will not be realized without the right people.   At Anadarko, we set ambitious goals and take disciplined risks to achieve them. We need individuals who will take on this challenge. We're planning for the future and looking for exceptional people to be part of it.","anadarko.jpg","http://www.columbia.edu/~rtd2118/logos/anadarko.jpg"
"anixter-international",0,"https://www.anixter.com/","At Anixter, we enable the connected world. From securer facilities and communities, to more efficient networks and industrial environments, we deliver the infrastructure solutions--and intelligence--that sustain your business. Through our superior product offerings, unmatched global distribution network, expert supply chain management and technical know-how, we drive efficiency and effectiveness to benefit your bottom line.    Anixter is a leading global supplier of communications and security products and electrical and electronic wire and cable. Anixter helps its customers specify solutions and make informed purchasing decisions around technologies, applications and relevant standards. At Anixter, we enable the connected world. From securer facilities and communities, to more efficient networks and industrial environments, we deliver the infrastructure solutions--and intelligence--that sustain your business. Through our superior product offerings, unmatched global distribution network, expert supply chain management and technical know-how, we drive efficiency and effectiveness to benefit your bottom line.    Anixter is a leading global supplier of communications and security products and electrical and electronic wire and cable. Anixter helps its customers specify solutions and make informed purchasing decisions around technologies, applications and relevant standards.","F500","anixter-international","Anixter International is a leading global distributor of communication and security products, electrical and electronic wire & cable, fasteners and other small parts. The company adds value to the distribution process by providing its customers access to 1) innovative inventory management programs, 2) more than 450,000 products and over $1 billion in inventory, 3) approximately 225 warehouses with 7 million square feet of space, and 4) locations in over 260 cities in more than 50 countries. Founded in 1957 and headquartered near Chicago, Anixter trades on the New York Stock Exchange under the symbol AXE.","anixter-international.jpg","http://www.columbia.edu/~rtd2118/logos/anixter-international.jpg"
