"name","web_url","desc"
"penske-automotive-group","https://www.penskeautomotive.com","Our objective is to be the most profitable, growth-oriented automotive retailer in each of the markets in which we operate. To achieve this objective, we intend to expand our existing business platform and continue to grow our higher-margin businesses, expand through targeted acquisitions, implement  _best practices  and emphasize customer service by having the best employees in the industry."
"pepsi","https://www.pepsi.com/","Our mission is to be the world's premier consumer products company focused on convenient foods and beverages. We seek to produce financial rewards to investors as we provide opportunities for growth and enrichment to our employees, our business partners and the communities in which we operate. In everything we do, we strive for honesty, fairness and integrity.    We are driven by the intense, competitive spirit of the marketplace, but we direct this spirit toward solutions that benefit both our company and our constituents. Our success depends on a thorough understanding of our customers, consumers and communities. To foster this spirit of generousity, we go the extra mile to show we care."
"performance-food-group-company","http://www.pfgc.com/","Through a dedication to food safety, a commitment to quality, and strong industry relationships, we develop unique brands that set us apart. We develop our own specifications and guidelines for each of our brands, then work with suppliers to choose the best products for inclusion. We also maintain active working relationships with the top industry associations and government agencies, which allows us to stay on the forefront of industry best practices and new technologies."
"pge","https://www.pge.com","Pacific Gas and Electric Company, incorporated in California in 1905, is one of the largest combined natural gas and electric energy companies in the United States. Based in San Francisco, the company is a subsidiary of PG&E CorporationOpens in new Window..      There are approximately 20,000 employees who carry out Pacific Gas and Electric Company's primary business--the transmission and delivery of energy. The company provides natural gas and electric service to approximately 16 million people throughout a 70,000-square-mile service area in northern and central California."
"philadelphia-insurance-companies","https://www.phly.com/","PHLY is a team of motivated, high achievers committed to delivering innovative products and unsurpassed service to niche   insurance markets. By maintaining a disciplined approach to business, we provide greater security for our policyholders   and superior value for our shareholder. We believe that integrity and mutual respect are the foundation of long-term and   fulfilling relationships with our employees, customers, and business partners."
"philip-morris","https://www.pmi.com/who-we-are","We are committed to being a great employer and a good corporate citizen. We strive to be environmentally and socially responsible. We are dedicated to fighting the illegal cigarette trade. And we proudly support the communities where we source tobacco and where our employees live and work."
"phillips","http://www.usa.philips.com/","Phillips is a health technology company based in the Netherlands, that integrates advanced technology and deep clinical and consumer insights to improve people's health and enable better outcomes across the health continuum from healthy living and prevention, to diagnosis, treatment and home care."
"pitney-bowes-inc","http://www.pitneybowes.com/us","At Pitney Bowes, we thrive on helping our clients navigate the complex world of commerce. We provide data so businesses can market to their best customers. We enable the sending of parcels and packages across the globe. And, we secure payments through statements and invoices to keep our clients moving forward.    Pitney Bowes is transforming by expanding into high-growth markets, including digital commerce and software, while continuing to innovate in our core shipping and mailing businesses."
"pizza-hut","https://www.pizzahut.com","There's nothing cookie-cutter about Pizza Hut. Not our pizzas. Not our people. And definitely not the way we live life. Around here, we don't settle for anything less than food we're proud to serve. And we don't just clock in. Not when we can also become our best, make friends, and have fun while we're at it. We're the pizza company that lives life unboxed.    We're not for people who want to blend in: pushing boundaries is part of our heritage. We have more than 16,000 restaurants and 350,000 team members in more than 100 countries. Whether it's the original Stuffed Crust or putting a pizza in outer space, we never stop driving ourselves to deliver hot pizzas, fast every time  _ anywhere you want to enjoy it.    At Pizza Hut, we don't just make pizza. We make people happy. Pizza Hut was built on the belief that pizza night should be special, and we carry that belief into everything we do. With more than 55 years of experience under our belts, we understand how to best serve our customers through tried and true service principles: We create food we're proud to serve and deliver it fast, with a smile."
"plains-gp-holdings","http://ir.pagp.com/","At Plains, our vision is to become the premier crude oil and NGL transportation and marketing company in the United States and Canada by providing the utmost in value-added services to our customers, and in doing so, delivering superior returns to our stakeholders.    Our Strategy  Our principal business strategy is to provide competitive and efficient midstream transportation, terminalling, storage, processing, fractionation, and supply and logistics services to producers, refiners and other customers. Toward this end, we endeavor to address regional supply and demand imbalances for crude oil and NGL in the United States and Canada by combining the strategic location and capabilities of our transportation, terminalling, storage, processing, and fractionation assets with our extensive supply, logistics, and distribution expertise."
"pnc","https://www.pnc.com/en/personal-banking.html","For more than 160 years, we have been committed to providing our clients with great service and powerful financial expertise to help them meet their financial goals. We are proud of our longstanding history of supporting not only our customers but also our communities, employees and shareholders."
"polaris-inds","http://www.polaris.com/en-us","For millions of people around the world, Polaris has become synonymous with adventure and passion, in both work and play. For more than 60 years, we've been making high-quality, breakthrough products--whether it's launching the snowmobile industry, reinventing ATV categories year after year, developing the first purpose-built military vehicles or introducing a radical 3-wheel moto-roadster.  From our entrepreneurial roots as a mechanical shop, we've grown into one of the world's largest Powersports companies. And in recent years, we've expanded beyond Powersports into adjacent markets, like commercial and military vehicles, where we can add value. Today, Polaris offers a diverse portfolio of best-in-class brands."
"porsche","http://www.porsche.com/usa/","The company's main objective is to achieve value-generating growth. Only by achieving such growth can we make sustainable investments in innovative technologies, new products, and most importantly, in our team here at Porsche.    With this approach we are already on our way towards rethinking sporty mobility. We want to excite customers with our products and services. We are also aiming to consolidate our reputation as an excellent employer and business partner that fulfils its social and environmental responsibilities. And the return needs to be sufficient too.    We have everything we need to achieve our objectives: vehicles that will take your breath away and a team that is passionate about its work."
"ppg","http://corporate.ppg.com/Home.aspx","PPG is a global manufacturer of paints, coatings, optical products, specialty materials, and fiber glass, and a Fortune 200 company with headquarters in Pittsburgh and operations in nearly 70 countries around the world. Our vision is to be the world's leading coatings company by consistently delivering high-quality, innovative and sustainable solutions that customers trust to protect and beautify their products and surroundings. This vision will guide us on our journey toward our common goals and principles."
"ppl-corporation","https://www.pplweb.com","OUR MISSION:  To provide reliable, safe energy at a reasonable cost to our customers and best-in-sector returns to our shareowners.    As one of the largest investor-owned companies in the U.S. utility sector, PPL Corporation delivers on its promises to customers, investors, employees and the communities we serve.    We are committed to providing essential energy services in extraordinary ways and we deliver."
"prada","http://www.pradagroup.com/en/brands/prada","Prada now produces men's and women's leather goods, clothing and footwear, combining contemporary, cutting-edge sophistication with one-of-a-kind, sublimely-crafted products. Prada also operates in the eyewear, fragrance and mobile phone sectors.    Innovation is at the core of Prada's success, with no sector escaping the Group's avante-garde approach, distribution included. Prada was the first brand to launch a new type of store, known as  _Prada Epicentres , designed by internationally-acclaimed architects such as Rem Koolhaas, and Herzog & de Meuron, both winners of the Pritzker Prize (the Nobel for architecture).  Prada casts its creative eye beyond the boundaries of fashion, to include art, architecture, cinema and culture as key reference to the brand's core values."
"pratt-and-whitney","http://www.pw.utc.com/","Pratt & Whitney, a United Technologies Corp. company (NYSE:UTX), is a world leader in the design, manufacture and service of aircraft engines and auxiliary power units.    Frederick Rentschler founded Pratt & Whitney in Hartford, Connecticut, in 1925. Our rst aircraft engine transformed the aviation industry. It was the 410-horsepower, air_cooled Wasp, which delivered unprecedented performance and reliability for the time. We have been leading change ever since.    Today, Pratt & Whitney develops game-changing technologies for the future, such as the PurePower PW1000G engine, with patented Geared Turbofan engine technology. The company's worldwide large commercial engine maintenance, repair and overhaul network provides innovative services that add value and delight customers around the globe.    Pratt & Whitney's large commercial engines power more than 25 percent of the world's mainline passenger fleet. The company continues to develop new engines and work with its partners in International Aero Engines and the Engine Alliance to meet airline customers' future needs.    Pratt & Whitney has built a long and distinguished record of providing top-of-the-line military engines to 31 armed forces around the world. Our military engines power front line fighters, such as the F-15 Eagle, F-16 Fighting Falcon, F-22 Raptor and F-35 Lightning II, as well as the C-17 Globemaster III military transport and Boeing's KC-46, the U.S. Air Force's new airlift tanker.    Pratt & Whitney Canada has produced more than 80,000 engines, of which there are currently more than 50,000 engines in service by more than 10,000 operators in 200 countries.    Pratt & Whitney AeroPower designs and manufactures auxiliary power units and turbojet engines for commercial and military aircraft. Products include airborne auxiliary power units and ground power units, and small expendable and recoverable turbojet propulsion systems."
"praxair","http://www.praxair.com","At Praxair, 26,000 employees in more than 50 countries are working together towards a common goal: making our planet more productive. For more than 100 years, Praxair has taken something as fundamental as air and turned it into ways to make plants operate cleaner and more productively, food taste better, breathing easier and manufacturing processes more efficient -- in short, to make all our lives better.    Our vision--to be the best performing industrial gas company in the world--includes more than financial performance. It is an ongoing commitment to our core values: safety, integrity, diversity, environmental stewardship, community engagement, customer satisfaction and operational excellence in all that we do."
"precision-castparts-corp","http://www.precast.com/","Precision Castparts is the world leader in structural investment castings, forged components, and airfoil castings for aircraft engines and industrial gas turbines. Airbus, Boeing, GE, Rolls-Royce, and many other leading manufacturers depend on us for critical airframe, engine, power generation, medical, and general industrial components. With few exceptions, every aircraft in the sky flies with parts made by PCC.  PCC is the market leader in manufacturing large, complex structural investment castings, airfoil castings, forged components, aerostructures and highly engineered, critical fasteners for aerospace applications. In addition, the Company is the leading producer of airfoil castings for the industrial gas turbine market. PCC manufactures extruded seamless pipe, fittings, forgings, and clad products for power generation and oil & gas applications; commercial and military airframe aerostructures; and metal alloys and other materials to the casting and forging industries.  The Company also provides:  Specialty alloys for the investment casting and forging industries;  High-performance, nickel-, titanium- and cobalt-based alloys engineered for optimum heat resistance, high-temperature corrosion resistance, toughness and strength, available in a full range of mill forms, including billet, ingot, tubing, sheet, strip, foil, plate, bar, rod, extruded shapes, rod-in-coil, wire and welding consumables;  Downhole casings, clad seamless pipe, tube, fittings, plate, sheet and bar in a variety of nickel, titanium and steel alloys for severe service oil and gas environments, extending from the bottom of the well through the distribution of refined products;  Seamless interconnect pipe for use in coal-fired power plants and industrial gas turbine installations;  Revert metal processing solutions for a wide range of industries;  Heat treating and destructive testing services for the investment casting and forging industries;  Investment castings and forgings for general industrial, automotive, armament, medical and other applications;  Fasteners for automotive and general industrial markets.  PCC is distinguished by preeminent leadership in the markets it serves, the high degree of proprietary technology and technical expertise inherent in its product lines, outstanding management of complex manufacturing processes and close attention to the creation of shareholder value.  The Company continues to invest in the growth of its core and supplemental businesses by expanding market share and creating new market opportunities, while seeking appropriate acquisitions through which this growth may be enhanced."
"priceline","https://www.priceline.com/","The Priceline Group is the world's leading provider of online travel & related services, provided to consumers and local partners in over 200 countries through six primary brands:  Booking.com, priceline.com, KAYAK, agoda.com, rentalcars.com, and OpenTable."
"principal-financial-group","https://www.principal.com/individuals","Our expertise spans the globe, but we're bound by one common purpose: to give you the financial tools, resources and information you need to live your best life.    Whether you're looking to secure your own retirement or your clients', we'll work with you to find strategies that are right for you to help you meet your specific, long-term goals.    Our focus on progress has us always looking to the future to ask, ""What's next?"" when it comes to doing more as a socially responsible company. The 2015 report highlights some of the ways we have made improvements in key socially responsible areas."
"prudential","https://www.prudential.com/","With operations in the United States, Asia, Europe and Latin America, we provide customers with a variety of products and services, including life insurance, annuities, retirement-related services, mutual funds and investment management. We strive to create long-term value for our stakeholders through strong business fundamentals, consistent with our mission guided by our vision and directed by our company's core values.    Prudential has a long history of helping customers achieve financial security and peace of mind. Our collective knowledge and expertise provides us with a unique understanding of the social issues that contribute to economic inequality. For this reason, we have a critical role to play in ensuring that everyone has the opportunity to achieve economic success."
"pseg","https://www.pseg.com/","Our power has long been instrumental in making life better for our customers. Today, citizenship at PSEG means continuing to deliver on that vital public service  _ and more  _ by taking a stronger interest in the needs of our customers, communities, shareholders and employees.  Our work brings us into our customers' neighborhoods, homes and businesses all day, every day. We strive to earn their trust by providing exceptional reliability and by demonstrating the values of a strong corporate citizen and community partner. In a time when people are increasingly dependent on electricity, we are making investments to strengthen our electric and gas systems. We cannot predict if or when the next extreme weather event occurs. A more resilient infrastructure helps safeguard our customers across our territory. Through our community, government and nonprofit partnerships, we work to provide the tools and preparation that reduce our vulnerability to these events.  As we consider the role that utilities will play in the future, we count sustainability as a driving imperative to encourage innovation and efficient, safe and economic energy practices. We need to address the roots of climate adaptation by reducing pressures on the environment. We will continue to emphasize a sustainable energy strategy based on energy efficiency, renewables and other advanced, clean technologies. Over many years we have made large investments to reduce emissions of traditional pollutants from our fossil-fueled plants to a small fraction of former levels.  Diversity and inclusion drive success across our company, and are an essential part of our culture. At PSEG, we define diversity to embrace the full breadth of all people, their ideas, thoughts and perspectives, and a vast blend of organizational and human characteristics, experiences, needs and traditions of our people. We strive to create an inclusive culture that fosters a sense of belonging to all members of our organization so that they are welcomed, respected and valued, as both human beings and business partners.   We are fortunate to have an outstanding workforce of diverse and highly skilled people who move us forward while giving back of their own time and support to the causes that matter most to them. Through our corporate and Foundation giving, we support and partner with those organizations that are powering a brighter future for the places we do business."
"publix","http://www.publix.com/","Our mission at Publix is to be the premier quality food retailer in the world.    To that end, we commit to be: Passionately focused on customer value, Intolerant of waste, Dedicated to the dignity, value and employment security of our associates, Devoted to the highest standards of stewardship for our stockholders, and Involved as responsible citizens in our communities. Publix has a long-standing tradition of being the kind of company a community can count on, beginning with our founding in 1930. Publix is proud of our accomplishments as a caring employer, industry leader, and member of the community."
"pultegroup","http://www.pultegroupinc.com","PulteGroup has been providing the American Dream of homeownership to families for more than 60 years. What started as a single home built and sold by the entrepreneurial spirit of an 18-year-old Bill Pulte, has grown into the industry's sole multi-brand homebuilding company with the ability to serve customers in all phases of life. Today, PulteGroup operates in approximately 50 markets throughout the country."
"purina","https://www.purina.com/","he reason we're so invested in the quality of our food is because we love pets as much as you do. You'll find pets in our homes, and even sitting by our feet as we work in our offices.    Our passion for pets goes beyond pushing pet nutrition forward, and into forging partnerships in the pet welfare world and raising awareness of what pets truly need. After all, we've seen firsthand how powerful the bond with a pet can be, and the many unique ways that pets can strengthen our families and bring our communities closer.    Because we want dedicated and passionate employees on our team, we make sure that Purina is a great place to work. You can tell from the moment you walk in the door that our world revolves around pets, whether you're seeing the art on the walls or the many cats and dogs that employees bring to work every day.    Recently, Glassdoor.com ranked Purina No. 3 on their 2015 Best Places to Work  _ an Employees' Choice Award list. For eight consecutive years, we've been recognized by the St. Louis Business Journal as the ""Best Place to Work"" and for the past three years, Purina has been recognized as the best place to work in St. Louis by the St. Louis Post Dispatch. We're proud of the fact that we help make our employees happy.    Our quest to drive pet nutrition forward and conduct industry-leading research on the wellbeing of pets pushes our company to do more year after year. We work hard for your pets every day, and we love doing it."
"pvh-corp","https://www.pvh.com/","PVH leverages a diversified portfolio of brands -- including CALVIN KLEIN, Tommy Hilfiger, Van Heusen, IZOD, ARROW, Speedo, Warner's and Olga, as well as numerous other owned and licensed brands -- and markets them globally. Our operational expertise, dedicated teams and commitment to each brand's differentiated market positioning, allow us to gain market share and expand our reach globally.    We are approximately 35,000 associates operating across 40 countries and speaking 20 languages. We generated $8.2 billion in revenues in 2016. We own the iconic CALVIN KLEIN, Tommy Hilfiger, Van Heusen, IZOD, ARROW, Speedo (1), Warner's and Olga brands and market a variety of goods under our owned and licensed brands."
"qualcomm","https://www.qualcomm.com/","In July 1985, seven industry veterans came together in the den of Dr. Irwin Jacobs' San Diego home to discuss an idea. Those visionaries--Franklin Antonio, Adelia Coffman, Andrew Cohen, Klein Gilhousen, Irwin Jacobs, Andrew Viterbi and Harvey White--decided they wanted to build  _Quality Communications  and outlined a plan that has evolved into one of the telecommunications industry's greatest start-up success stories: Qualcomm Incorporated.    That's how often people around the world touch something made better by Qualcomm. It could be the smartphone in your pocket, the tablet on your coffee table, that wireless modem in your briefcase _ it could even be that navigation system in your car or that action camera strapped to your chest.    Who is Qualcomm, and what do we do? We are engineers, scientists and business strategists. We are from many different countries and speak many different languages. We come from diverse cultures and have unique perspectives. Together, we focus on a single goal--invent mobile technology breakthroughs."
"quanta-services-inc","http://www.quantaservices.com/","Quanta Services safely provides engineering, procurement and construction (EPC) services for comprehensive infrastructure needs in the electric power and oil and natural gas industries. With a workforce tens of thousands strong and offices across North America and abroad, Quanta is the premier provider in the industries it serves. Through a team of electric power and oil and gas service companies, Quanta Services is the complete solution.    Who we are:    Demonstrates best-in-class safety leadership and performance while delivering exceptional value to our customers.  The largest electric transmission and distribution specialty contractor in North America.  Largest employer of certified electric power linemen in North America.  The largest pipeline specialty contractor in North America.  The owner of the largest specialized equipment fleet in the industry.  Fortune 400 company with a strong balance and the financial resources for capital-intensive projects.  Full service engineering, procurement and construction (EPC) service provider.  An innovator of technologies and proprietary methodologies."
