"name","include","url","brand_identity","source","cb_id","cb_desc","logo_file","logo_url"
"assurant",0,"https://www.assurant.com/","Assurant, Inc. helps people protect what matters most to them. We provide specialty protection products and related services to safeguard against risks. With a strong commitment to service, sophisticated technology and an array of flexible tools, we build solutions to meet customers' needs.    Our businesses -- Assurant Solutions and Assurant Specialty Property -- serve customers and clients in the United States and select worldwide markets. All of our employees are dedicated to the same goal: Working with integrity, innovation and dedication so that customers are glad they chose Assurant when it matters most. Assurant, Inc. helps people protect what matters most to them. We provide specialty protection products and related services to safeguard against risks. With a strong commitment to service, sophisticated technology and an array of flexible tools, we build solutions to meet customers' needs.    Our businesses -- Assurant Solutions and Assurant Specialty Property -- serve customers and clients in the United States and select worldwide markets. All of our employees are dedicated to the same goal: Working with integrity, innovation and dedication so that customers are glad they chose Assurant when it matters most.","F500","assurant","Assurant, Inc. is a provider of specialty insurance products in the U.S. and select worldwide markets. Assurant partners with industry market leaders to deliver security and peace of mind for our customers. The company operates its business through four business segments: Assurant Employee Benefits, Assurant Health, Assurant Solutions and Assurant Specialty Property. With more than 100 years of experience in the insurance industry combined, Assurant is led by a team of talented employees whose insurance industry expertise drives our strong performance.","assurant.png","http://www.columbia.edu/~rtd2118/logos/assurant.png"
"att",0,"https://www.att.com/","At AT&T, we're bringing it all together. We deliver advanced mobile services, next-generation TV, high-speed internet and smart solutions for people and businesses. That's why we're investing to be the premier integrated communications company.  Fast, highly secure and mobile connectivity  _ to everything on the internet, everywhere, at every moment and on every device  _ is what drives us. It's reflected in our mission:  Connect people with their world, everywhere they live, work and play _and do it better than anyone else.  So our customers can stay connected from nearly anywhere. It doesn't matter if they're driving home from work or traveling across the country or beyond.  Customers want to enjoy their favorite movies, TV shows, music and sports on any screen. We're the largest provider of pay TV in the United States. So, we're setting the standard for delivering video when, where and how customers want it.  In the United States, we offer TV and wireless nationwide, plus a large high-speed internet footprint. We offer a wide choice of internet speeds to meet customers' needs. With our 100% fiber network, customers in 46 markets can download a 90-minute HD movie in less than 36 seconds, a 30-minute TV episode in 3 seconds and 25 songs in 1 second. We plan to expand these speeds to 21 more metro areas, at least 67 metros in total. We also offer pay TV in 11 Latin American countries.  We offer solutions that help businesses in every industry serve their customers better. We deliver advanced services to nearly 3.5 million businesses on 6 continents. That includes nearly all of the Fortune 1000 as well as neighborhood businesses across the United States.  Our high-speed mobile internet network covers nearly 400 million people and businesses across the U.S. and Mexico. We also wirelessly connect cars, machines, shipping containers and more. It's all part of our leadership in what's called the Internet of Things.  And we never stop innovating. The brightest minds in the business are in our AT&T Labs and Foundry centers developing new technologies, apps, products and services.  We envision a world where everything and everyone work together. We envision a world that works for you. At AT&T, we're bringing it all together. We deliver advanced mobile services, next-generation TV, high-speed internet and smart solutions for people and businesses. That's why we're investing to be the premier integrated communications company.  Fast, highly secure and mobile connectivity  _ to everything on the internet, everywhere, at every moment and on every device  _ is what drives us. It's reflected in our mission:  Connect people with their world, everywhere they live, work and play _and do it better than anyone else.  So our customers can stay connected from nearly anywhere. It doesn't matter if they're driving home from work or traveling across the country or beyond.  Customers want to enjoy their favorite movies, TV shows, music and sports on any screen. We're the largest provider of pay TV in the United States. So, we're setting the standard for delivering video when, where and how customers want it.  In the United States, we offer TV and wireless nationwide, plus a large high-speed internet footprint. We offer a wide choice of internet speeds to meet customers' needs. With our 100% fiber network, customers in 46 markets can download a 90-minute HD movie in less than 36 seconds, a 30-minute TV episode in 3 seconds and 25 songs in 1 second. We plan to expand these speeds to 21 more metro areas, at least 67 metros in total. We also offer pay TV in 11 Latin American countries.  We offer solutions that help businesses in every industry serve their customers better. We deliver advanced services to nearly 3.5 million businesses on 6 continents. That includes nearly all of the Fortune 1000 as well as neighborhood businesses across the United States.  Our high-speed mobile internet network covers nearly 400 million people and businesses across the U.S. and Mexico. We also wirelessly connect cars, machines, shipping containers and more. It's all part of our leadership in what's called the Internet of Things.  And we never stop innovating. The brightest minds in the business are in our AT&T Labs and Foundry centers developing new technologies, apps, products and services.  We envision a world where everything and everyone work together. We envision a world that works for you.","BD","at-t","AT&T is a telecommunications company that provides wireless communications, local exchange, and long-distance services for consumers and businesses in the United States and internationally.  The company offers its services in two segments: wireless and wireline. Its wireless segment offers various wireless voice, data, text, and other services. This segment sells various handsets, wirelessly-enabled computers, and wireless data cards for personal computers through its owned stores, agents, and third-party retail stores. It also sells accessories comprising carrying cases, hands-free devices, batteries, battery chargers, and other items to consumers as well as to agents and third-party distributors. As of December 31, 2013, this segment served approximately 110 million wireless subscribers.  The company's wireline segment provides data services such as switched and dedicated transport, DSL internet access, network integration, managed web hosting, packet, and enterprise networking services as well as local, interstate, and international wholesale networking capacity solutions to other service providers. This segment also offers voice services consisting of local and long-distance services; wholesale switched access services to other service providers; and outsourcing and integration services as well as CPE and government-related services. This segment has served approximately 12 million retail consumers, 10 million retail businesses, and 2 million wholesale access lines.  AT&T is headquartered in Dallas, Texas.","att.png","http://www.columbia.edu/~rtd2118/logos/att.png"
"autoliv",0,"https://www.autoliv.com/","To be the leading supplier of safety systems for future car, well integrated with autonomous driving. Autoliv exists to save lives and create long term sustainable value. To do this I believe we need to deliver in three  areas.  -Quality, which leads to trust and security. This is the number one priority.  -Robustness, providing the durability and functions our customers expects over time.  -User experience, ensuring our products are easy to understand and use. To be the leading supplier of safety systems for future car, well integrated with autonomous driving. Autoliv exists to save lives and create long term sustainable value. To do this I believe we need to deliver in three  areas.  -Quality, which leads to trust and security. This is the number one priority.  -Robustness, providing the durability and functions our customers expects over time.  -User experience, ensuring our products are easy to understand and use.","F500","autoliv","Autoliv, Inc. (Autoliv) is a holding company. Autoliv is the supplier of automotive safety systems, with a range of product offerings, including modules and components for passenger and driver-side airbags, side-impact airbag protection systems, seatbelts, steering wheels, safety electronics, whiplash protection systems and child seats, as well as night vision systems, radar and other active safety systems. Autoliv has two main operating segments: airbags/seatbelt (including restraint electronics) products and active safety electronics products. In addition, in April 2010, Autoliv Inc.'s Automotive Holding AS increased its stake in Norma AS from 51% to 93.74%. Additionally, Skandinaviska Enskilda Banken AB and ING Luxembourg SA sold their 6.67% and 10% stake, respectively, held in Norma AS. In November 2011, the Company acquired the airbag cushion cut&sew assets from Milliken. In June 2012, the Company sold its subsidiary Autoliv Mekan AB to Verktygs Allians i Hassleholm AB.","autoliv.png","http://www.columbia.edu/~rtd2118/logos/autoliv.png"
"autonation",0,"https://www.autonation.com/","AutoNation, Inc., through its subsidiaries, is the largest automotive retailer in the United States. As of December 31, 2016, we owned and operated 371 new vehicle franchises from 260 stores located in the United States, predominantly in major metropolitan markets in the Sunbelt region. Our stores, which we believe include some of the most recognizable and well-known in our key markets, sell 35 different new vehicle brands. The core brands of new vehicles that we sell, representing approximately 94% of the new vehicles that we sold in 2016, are manufactured by Toyota (including Lexus), Ford, Honda, General Motors, FCA US, Mercedes-Benz, Nissan, BMW, and Volkswagen (including Audi and Porsche). We offer a diversified range of automotive products and services, including new vehicles, used vehicles,  _parts and service,  which includes automotive repair and maintenance services as well as wholesale parts and collision businesses, and automotive  _finance and insurance  products, which include vehicle service and other protection products, as well as the arranging of financing for vehicle purchases through third-party finance sources. The following charts present the contribution to total revenue and gross profit by each of new vehicle, used vehicle, parts and service, and finance and insurance sales in 2016. AutoNation, Inc., through its subsidiaries, is the largest automotive retailer in the United States. As of December 31, 2016, we owned and operated 371 new vehicle franchises from 260 stores located in the United States, predominantly in major metropolitan markets in the Sunbelt region. Our stores, which we believe include some of the most recognizable and well-known in our key markets, sell 35 different new vehicle brands. The core brands of new vehicles that we sell, representing approximately 94% of the new vehicles that we sold in 2016, are manufactured by Toyota (including Lexus), Ford, Honda, General Motors, FCA US, Mercedes-Benz, Nissan, BMW, and Volkswagen (including Audi and Porsche). We offer a diversified range of automotive products and services, including new vehicles, used vehicles,  _parts and service,  which includes automotive repair and maintenance services as well as wholesale parts and collision businesses, and automotive  _finance and insurance  products, which include vehicle service and other protection products, as well as the arranging of financing for vehicle purchases through third-party finance sources. The following charts present the contribution to total revenue and gross profit by each of new vehicle, used vehicle, parts and service, and finance and insurance sales in 2016.","F500","autonation","AutoNation, Inc. (AutoNation) is an automotive retailer in the United States. As of December 31, 2011, the Company had three operating segments: Domestic, Import, and Premium Luxury. As of December 31, 2011, it owned and operated 258 new vehicle franchises from 215 stores located in the United States, predominantly in metropolitan markets in the Sunbelt region. Its stores sell 32 different brands of new vehicles. The core brands of vehicles that it sells, representing approximately 90% of the new vehicles that it sold during the year ended December 31, 2011, was manufactured by Ford, Toyota, Nissan, General Motors, Honda, Mercedes-Benz, BMW, and Chrysler. The Company offers a diversified range of automotive products and services, which include new vehicles, used vehicles, parts and automotive repair and maintenance services, and automotive finance and insurance products. In January 2014, Autobytel Inc. acquired AutoUSA from AutoNation, Inc.","autonation.png","http://www.columbia.edu/~rtd2118/logos/autonation.png"
"autoowners-insurance-group",0,"http://www.auto-owners.com/","For 100 years, Auto-Owners has been dedicated to the independent agency system. We're proud to be ranked among the Fortune 500 every year for the past 14 years, and our written premium is almost $6 billion.Comprised of five property and casualty companies and one life/health/annuity insurer, the group is recognized for exceptional financial strength and stability among the nation's largest insurers. For 100 years, Auto-Owners has been dedicated to the independent agency system. We're proud to be ranked among the Fortune 500 every year for the past 14 years, and our written premium is almost $6 billion.Comprised of five property and casualty companies and one life/health/annuity insurer, the group is recognized for exceptional financial strength and stability among the nation's largest insurers.","F500","auto-owners-insurance","Auto-Owners Insurance is the largest property and casualty insurance company domiciled in Michigan.  Auto-Owners success can be traced back from its present management to the early leadership of Vern V. Moulton who, in 1916, organized Auto-Owners Insurance Company in Mt. Pleasant, Michigan. The infant Company had no capital and was housed in one room of a bank building.  Auto-Owners operated in Mt. Pleasant for a little less than a year. In 1917, V.V. Moulton literally picked the Company up, placed it under his arm and in his pocket (the Company consisted of one book of policyholders' names and $174.25 in assets), and moved Auto-Owners to Lansing, Michigan.  It wasn't long before the Depression began, and Auto-Owners weathered even the lowest point of that era - the bank holidays of February 1933. The Company demonstrated its corporate toughness and financial stability by paying all claims promptly, daily, and IN CASH! The firm was then writing more than $2.5 million in insurance premiums.  Auto-Owners entered the general casualty insurance field in 1940, having previously written only automobile insurance. During the next five years, the Company found it necessary to acquire three more buildings in the vicinity of its main office to accommodate its continued growth. In 1951 it consolidated all of its offices into one home office, which was constructed in downtown Lansing.","autoowners-insurance-group.png","http://www.columbia.edu/~rtd2118/logos/autoowners-insurance-group.png"
"avery-dennison-corporation",0,"http://www.averydennison.com/en/home.html","Avery Dennison manufactures and distributes display graphics, labeling and packaging materials, retail graphic embellishments and RFID tags that companies around the world use to engage customers and efficiently manage their inventories. Our products are virtually everywhere you look, providing a crucial thread in the fabric of global commerce.    We sustain Stan Avery's spirit of curiosity through research, invention and development of new materials science products and processes. Our expertise in high-speed manufacturing, information display and management, logistics, branding, graphics and packaging enables us to impact a wide array of markets--from consumer packaged goods and apparel to transportation, architecture and healthcare. Avery Dennison manufactures and distributes display graphics, labeling and packaging materials, retail graphic embellishments and RFID tags that companies around the world use to engage customers and efficiently manage their inventories. Our products are virtually everywhere you look, providing a crucial thread in the fabric of global commerce.    We sustain Stan Avery's spirit of curiosity through research, invention and development of new materials science products and processes. Our expertise in high-speed manufacturing, information display and management, logistics, branding, graphics and packaging enables us to impact a wide array of markets--from consumer packaged goods and apparel to transportation, architecture and healthcare.","F500","avery-dennison","Avery Dennison Corporation (Avery Dennison), is engaged in the production of pressure-sensitive materials, and a variety of tickets, tags, labels other converted products, and office and consumer products through embossing, printing, stamping and die-cutting. The Company operates in two segments: Pressure-sensitive Materials and Retail Branding and Information Solutions. In addition to its reportable segments, the Company has other specialty converting businesses comprised of Vancive Medical Technologies (Vancive) and Designed and Engineered Solutions (DES). Some are sold by the Company in converted form as printable media, tapes and reflective sheeting. In July 2013, Avery Dennison Corp completed the sale of its Office and Consumer Products and Designed and Engineered Solutions businesses to CCL Industries Inc.","avery-dennison-corporation.png","http://www.columbia.edu/~rtd2118/logos/avery-dennison-corporation.png"
"avis-budget-group",0,"http://www.avisbudgetgroup.com/","Avis Budget Group's brands are differentiated to help the Company meet a wide range of customer needs throughout the world. Avis is a leading rental car supplier positioned to serve the premium commercial and leisure segments of the travel industry, and Budget is a leading rental vehicle supplier focused primarily on more value-conscious segments of the industry. Avis Budget Group licenses the use of the Avis and Budget trademarks to licensees in areas in which the Company does not operate directly. These brands have an extended global reach with more than 11,000 car and truck rental locations throughout the world. The Zipcar brand is the world's leading car sharing company, with nearly one million members in the United States, Canada and Europe. Avis Budget Group operates Budget Truck, one of the leading truck rental businesses in the United States.    Avis Budget Group is dedicated to being a best-in-class Customer Led, Service Driven organization, one that drives increased loyalty and profitable growth. The Company has two operating regions: the Americas and International. Avis Budget Group's brands are differentiated to help the Company meet a wide range of customer needs throughout the world. Avis is a leading rental car supplier positioned to serve the premium commercial and leisure segments of the travel industry, and Budget is a leading rental vehicle supplier focused primarily on more value-conscious segments of the industry. Avis Budget Group licenses the use of the Avis and Budget trademarks to licensees in areas in which the Company does not operate directly. These brands have an extended global reach with more than 11,000 car and truck rental locations throughout the world. The Zipcar brand is the world's leading car sharing company, with nearly one million members in the United States, Canada and Europe. Avis Budget Group operates Budget Truck, one of the leading truck rental businesses in the United States.    Avis Budget Group is dedicated to being a best-in-class Customer Led, Service Driven organization, one that drives increased loyalty and profitable growth. The Company has two operating regions: the Americas and International.","BD","avis-budget-group","Avis Budget Group, Inc. (Avis Budget) operates two brands in the global vehicle rental industry through Avis and Budget. Avis is a rental car supplier positioned to serve the commercial and leisure segments of the travel industry and Budget is a rental car supplier focused primarily on more value-conscious segments of the industry. It operates in three segments: North America, consisting of its Avis and Budget car rental operations in the United States and its Avis and Budget vehicle rental operations in Canada; International, consisting of its Avis and Budget vehicle rental operations in Europe, the Middle East, Asia, Africa, South America, central America, the Caribbean, Australia and New Zealand, and Truck Rental, consisting of its Budget truck rental operations in the United States. On October 3, 2011, the Company acquired Avis Europe plc. In July 2013, Avis Budget Group Inc acquired Payless Car Rental. `","avis-budget-group.jpg","http://www.columbia.edu/~rtd2118/logos/avis-budget-group.jpg"
"avnet",0,"http://www.avnet.com/","Since 1921, our strong values have guided how we operate and interact with our customers, suppliers and with each other. We believe that earning your trust is a privilege and doing the right thing is always the best course of action. Our Core Values, Code of Conduct and company policies reflect our commitment to doing business with integrity.    Our flexible approach also means we understand there is usually more than one way to accomplish your objectives. We'll show you the various options and guide you to the one that aligns with the skills of your team, your business model and your time to market objectives. We can show you how to design a circuit board with sensing, processing and connectivity features or integrate off the shelf boards and modules into an embedded appliance. We'll guide you to the right components you need for different IoT applications. Since 1921, our strong values have guided how we operate and interact with our customers, suppliers and with each other. We believe that earning your trust is a privilege and doing the right thing is always the best course of action. Our Core Values, Code of Conduct and company policies reflect our commitment to doing business with integrity.    Our flexible approach also means we understand there is usually more than one way to accomplish your objectives. We'll show you the various options and guide you to the one that aligns with the skills of your team, your business model and your time to market objectives. We can show you how to design a circuit board with sensing, processing and connectivity features or integrate off the shelf boards and modules into an embedded appliance. We'll guide you to the right components you need for different IoT applications.","F500","avnet","Avnet, Inc. (NYSE:AVT) is one of the largest distributors of electronic components, computer products and embedded technology serving customers in more than 70 countries worldwide. Avnet accelerates its partners' success by connecting the world's leading technology suppliers with a broad base of more than 100,000 customers by providing cost-effective, value-added services and solutions. For the fiscal year ended June 27, 2009, Avnet generated revenue of US $16.23 billion.","avnet.png","http://www.columbia.edu/~rtd2118/logos/avnet.png"
