"name","web_url","desc"
"intl-fcstone","https://www.intlfcstone.com/","INTL FCStone Inc. (Nasdaq: INTL) provides clients across the globe with a comprehensive range of customized financial services and tools to help them protect their margins and manage volatility. A pioneer in specialized financial services, we open markets for underserved mid-market clients with insight, guidance and access. We believe that every company--regardless of size, regardless of industry, regardless of how long they've been in business--deserves access to the best advice, the best products, and the best, most efficient market access."
"invesco","http://www.invesco.com","As one of the largest independent global investment managers, Invesco Ltd. is dedicated to helping people worldwide build their financial security.    Invesco strives to deliver outstanding products and services through a comprehensive array of enduring investment solutions for our retail, institutional and private wealth management clients around the world.    Invesco is an independent investment management firm dedicated to delivering an investment experience that helps people get more out of life.    Our single focus is to help clients achieve their investment objectives  We are well-positioned to help clients achieve their investment objectives, due to our:    We believe the best investment insights come from specialized investment teams with discrete investment perspectives, operating under a disciplined philosophy and process with strong risk oversight. Our pure focus on investment management eliminates the distractions that compromise results.    As an independent firm, our global organization is solely focused on investment management. We direct all of our intellectual capital, global strength and operational stability toward helping clients achieve their investment objectives."
"iron-mountain-inc","http://www.ironmountain.com/","Organizations across the globe trust us to store and protect information and assets. Thousands of local enterprises work with us, as does almost all of the FORTUNE 1000. From critical business information to geological samples, works of fine art to original recordings of treasured artists, our customers can rely on us to protect what they value and help unlock its potential.  We help our customers to lower storage costs, comply with regulations, manage risks, and use the value in their information to grow. Our solutions include information and asset storage, records management, data centers, data management and secure shredding. Founded in 1951, we store and protect business documents, backup tapes, electronic files, medical data and other assets.We treat the information and assets of our customers as if they were our own.    We invest in security technology.  We conduct background checks on all employees and provide ongoing security training.  We submit to third party security audits to enhance our security culture.  We follow and help set the strictest industry standards for safeguarding information and data privacy."
"itw","http://www.itw.com/","Since our founding more than 100 years ago, ITW has become one of the world's leading diversified manufacturers of specialized industrial equipment, consumables, and related service businesses.    ITW businesses serve local customers and markets around the globe, with a significant presence in developed as well as emerging markets. The company has operations in 57 countries that employ more than 50,000 women and men who adhere to the highest ethical standards. These talented individuals, many of whom have specialized engineering or scientific expertise, contribute to our global leadership in innovation. We are proud of our broad portfolio of more than 17,500 granted and pending patents."
"jabil","http://www.jabil.com/","Jabil's engineering, manufacturing and intelligent supply chain solutions help you capitalize on this accelerated change and achieve digital business advantage. Thanks to the diversity of our expertise, technology assets and service options, there are virtually no limits to how you can team up with us. And together with our talented people, globally unified data and systems, and focused, intelligent approach to ensuring customer success  _ you can gain competitive advantage from supply chains and become a change agent in the industry rather than simply reacting to competitive pressures."
"jack-daniels","http://www.jackdaniels.com","Jasper Newton Daniel, more commonly known as Jack, introduces the world to Old No. 7, his signature charcoal-mellowed Tennessee.    CHARCOAL MELLOWED. DROP BY DROP.  Mellowed drop by drop through 10-feet of sugar maple charcoal, then matured in handcrafted barrels of our own making. And our Tennessee Whiskey doesn't follow a calendar. It's only ready when our tasters say it is. We judge it by the way it looks. By its aroma. And of course, by the way it tastes. It's how Jack Daniel himself did it over a century ago. And how we still do it today"
"jack-in-the-box","http://www.jackintheboxinc.com/","Founded in 1951, Jack in the Box Inc. is a restaurant company that operates and franchises Jack in the Box restaurants and--through a wholly owned subsidiary--Qdoba Mexican Eats restaurants.    Jack in the Box is among the nation's leading fast-food hamburger chains, with more than 2,200 quick-serve restaurants in 21 states and Guam. As the first major hamburger chain to develop and expand the concept of drive-thru dining, Jack in the Box has always emphasized on-the-go convenience, with approximately 85 percent of the half-billion guests served annually buying food at the drive-thru or for take-out. In addition to drive-thru windows, most restaurants have indoor dining areas and are open 18-24 hours a day.    Jack in the Box pioneered a number of firsts in the quick-serve industry, including menu items that are now staples on most fast-food menu boards, like the breakfast sandwich and portable salads. Today, Jack in the Box offers a selection of distinctive, innovative products targeted at the fast-food consumer, including hamburgers, specialty sandwiches, salads and real ice cream shakes. Hamburgers represent the core of the menu, including the signature Jumbo Jack, Sourdough Jack, Ultimate Cheeseburger and Buttery Jack_ burgers. And, because value is important to fast-food customers, the company's menu also features Jack's Deals, which includes value-priced products like tacos, chicken nuggets, a chicken sandwich and a Jr.. Bacon Cheeseburger.    In addition to offering high-quality products, Jack in the Box recognizes that an increasing number of quick-serve customers also want the ability to customize their meals. Whether that means forgoing the bun and sauce in favor of a low-carb burger, or substituting ingredients to create the exact mix of flavors to suit an individual's personal tastes, customers have that flexibility at Jack in the Box.  _We don't make it  til you order it.  So, regardless of the order, each meal is served hot and fresh to customers. We also serve our full menu, including breakfast, all day every day. So whether you want a Buttery Jack_ burger for breakfast or Breakfast Jack sandwich for dinner, you can get what you want whenever you want it at Jack in the Box."
"jacobs-engineering","http://www.jacobs.com/about#overview","At Jacobs, our focus on building long-term client relationships has helped us become one of the largest and most diverse providers of technical, professional and construction services, including all aspects of architecture, engineering and construction, operations and maintenance, as well as scientific and specialty consulting. Our 54,000 employees in 230+ locations around the world serve a broad range of companies and organizations, including industrial, commercial, and government clients across multiple markets and geographies."
"jarden-corporation","http://www.jardencs.com","Jarden Consumer Solutions is a wholly owned subsidiary of Newell Brands Inc. (NYSE:NWL). Our well-known brands include: Bionaire, Breville, Crock-Pot, FoodSaver, Health o meter, Holmes, Mr. Coffee, Oster, Patton, Rainbow, Rival, Seal-a-Meal, skybar, Sunbeam, and VillaWare. We're a company whose employees  _ more than 6,000 strong in twenty countries  _ are committed to a set of core values that emphasize integrity, community service and entrepreneurship. We're always looking for solutions to help make consumers' lives easier, safer and fun. For nearly 100 years, consumers have trusted our brands and products, and we're proud to be a part of their lives."
"jb-hunt-transport-services","https://www.jbhunt.com/","We forge long-term relationships with key customers that include supply chain management as an integral part of their strategy. Working in concert, we drive out cost, add value and function as an extension of their enterprise.Our ability to offer multiple services, utilizing our four business segments and a full complement of logistics services through third parties, represents a competitive advantage. We believe this unique operating strategy can add value to customers and increase our profits and returns to stockholders."
"jc-penney","http://www.jcpenney.com/","JCPenney is Your One-Stop Shop for Easter Clothes, Shoes & Accessories  At JCPenney, we're dedicated to bringing you the very best in stylish and affordable goods. Your entire family will look their best with our selection of Easter clothing! Shop Easter dresses for women and girls in stunning colors, beautiful designs, and flattering silhouettes. We have handsome dress clothes for men and boys, including two-piece suits and dress shirts in spring inspired colors. Get darling Easter outfits for babies and toddlers that are just picture perfect! Match your outfits with new Easter shoes from our shoe department, and finish the look with the right accessories! At JCPenney, you'll find everything you need for a stylish Easter. Your journey towards better value starts and ends with us, online or in your closest JCPenney store!"
"jetblue-airways-corporation","https://www.jetblue.com/#/","JetBlue is a leader in it's field. Rates in the top ten  as far as size of airline company.They also offer many great deals including multiple rewards programs for frequent flyers."
"jm-smucker","http://www.jmsmucker.com/","The J.M. Smucker Company family of brands has grown to include a wide variety of quality products that all meet the high standards you've come to expect from Smucker.The J.M. Smucker Company's Purpose is helping to bring families together to share memorable meals and moments. We follow several basic beliefs regarding Quality, People, Ethics, Growth, and Independence have served as a strong foundation throughout our history and will continue to be the basis for future strategy, plans, and accomplishments."
"john-hancock","http://www.johnhancock.com","John Hancock's core retail products in the U.S. focus on providing financial solutions at every stage of our clients' lives. Our product suite includes life insurance, mutual funds, 401(k) plans, and annuities. We distribute our products primarily through licensed financial advisors, and through Signator Investors, Inc., a national network of independent firms. In addition to offering financial solutions, John Hancock is a vibrant organization that also focuses on making a difference - in our community, in the lives of our employees, and for the environment."
"johnnie-walker","https://www.johnniewalker.com/en-in/","Johnnie Walker is a brand of Scotch whisky owned by Diageo that originated in Kilmarnock, Ayrshire, Scotland. It is the most widely distributed brand of blended Scotch whisky in the world, sold in almost every country, with annual sales of the equivalent of over 226.2 million 750 ml bottles in 2015"
"johnson-controls","http://www.johnsoncontrols.com/","The future is being built today, and Johnson Controls is making that future more productive, more secure and more sustainable. We create intelligent buildings, efficient energy solutions, integrated infrastructure and next generation transportation systems that work seamlessly together to deliver on the promise of smart cities and communities. At its core, that promise is about delivering innovation that make people's lives  _ and the world  _ better.    We are committed to helping our customers win and creating greater value for all of our stakeholders through strategic focus on our buildings and energy growth platforms. We promise honesty and transparency. We uphold the highest standards of integrity and honor the commitments we make.    We believe in doing well by doing good and hold ourselves accountable to make the world a better place through the solutions we provide, our engagement in society, the way we do business, and our commitment to protect people and the environment."
"johnson-johnson","https://www.jnj.com/","We believe our first responsibility is to the doctors, nurses and patients, to mothers and fathers and all others who use our products and services. In meeting their needs everything we do must be of high quality. We must constantly strive to reduce our costs in order to maintain reasonable prices. Customers' orders must be serviced promptly and accurately. Our suppliers and distributors must have an opportunity to make a fair profit.    We are responsible to our employees, the men and women who work with us throughout the world. Everyone must be considered as an individual. We must respect their dignity and recognize their merit. They must have a sense of security in their jobs. Compensation must be fair and adequate, and working conditions clean, orderly and safe. We must be mindful of ways to help our employees fulfill their family responsibilities. Employees must feel free to make suggestions and complaints. There must be equal opportunity for employment, development and advancement for those qualified. We must provide competent management, and their actions must be just and ethical.    We are responsible to the communities in which we live and work and to the world community as well. We must be good citizens  _ support good works and charities and bear our fair share of taxes. We must encourage civic improvements and better health and education. We must maintain in good order the property we are privileged to use, protecting the environment and natural resources.    Our final responsibility is to our stockholders. Business must make a sound profit. We must experiment with new ideas. Research must be carried on, innovative programs developed and mistakes paid for. New equipment must be purchased, new facilities provided and new products launched. Reserves must be created to provide for adverse times. When we operate according to these principles, the stockholders should realize a fair return."
"johnsons","https://www.jnj.com","We believe our first responsibility is to the doctors, nurses and patients, to mothers and fathers and all others who use our products and services. In meeting their needs everything we do must be of high quality. We must constantly strive to reduce our costs in order to maintain reasonable prices. Customers' orders must be serviced promptly and accurately. Our suppliers and distributors must have an opportunity to make a fair profit.    We are responsible to the communities in which we live and work and to the world community as well. We must be good citizens  _ support good works and charities and bear our fair share of taxes. We must encourage civic improvements and better health and education. We must maintain in good order the property we are privileged to use, protecting the environment and natural resources."
"jones-lang-lasalle-incorporated","http://www.jll.com","JLL is a financial and professional services firm specializing in commercial real estate services and investment management. We create value for companies and institutions that invest in and use real estate. With more than 77,000 employees across 300 corporate offices worldwide, we serve the local, regional and global real estate needs of corporates and investors in more than 80 countries. Our integrated services offering is grounded in expertise in all property types, a deep understanding of real estate markets and capital markets, and is coordinated and consistent across geographies.    JLL is a public company whose leaders are committed to creating value for our clients and shareholders. We've been building relationships and expanding our global footprint since our 1783 founding in London. Our experts have redefined the industry and changed the way organizations look at real estate."
"jp-morgan","https://www.jpmorgan.com/country/VE/en/jpmorgan","Our commitment to helping clients in Latin America dates back to the 19th century. As a result of our long-standing presence, we have built long-term and trusted relationships with Latin American industry leaders, financial institutions, governments, family-owned businesses and private clients"
"kelloggs","https://www.kelloggs.com","We are a company of promise and possibilities. Each day represents a fresh opportunity to share Our Vision, live Our Purpose.     By being mindful and committed to these ideals, we uphold our founder's dedication to people and their well-being. And we promote an environment where we can push beyond boundaries and across borders to create foods and brands that help to fuel the best in everyone everywhere.     It is this belief that brings us together and sets us apart."
"kelly-services","http://www.kellyservices.co.in/IN/Careers/Career-Hub/Online-Application-Tips/Build-Your-Digital-Profile/?hid=CA","This is nothing new, it's just that the ways in which you can do this have changed-- and mostly they've moved online. However, you don't need to be a tech genius to sell your skills online. There are many simple and free tools you can use to get started that are no more difficult than building an animated PowerPoint presentation. (And there are plenty of tutorials and tips online to help you if you get stuck!)    Ideally, building a digital portfolio is about demonstrating your  brand' through online activity. It shows employers what you're passionate about and driven by; how you communicate and engage with others, as well as leadership or innovation in your field. Don't just blog or post, start building an online portfolio that employers can use to connect with you, understand you and identify the right opportunities for you."
"kenworth","http://www.kenworth.com","At Kenworth, we're always enhancing products to help you improve your bottom line.     Kenworth trucks are recognized and respected for their excellent quality, fuel efficiency and durability. With the new program's official launch in January 2017, truck buyers will receive a high level of confidence when buying pre-owned Kenworths that have undergone thorough inspections and are certified according to Kenworth's high standards."
"keycorp","https://www.keycorp.net","A leading, independent provider of services to the payments and retail industries, Keycorp's customers depend on us to provide quality services and secure software applications utilising 30 years of local and global expertise in the payments, retail and related industries."
"kfc","https://www.kfc.com/","KFC Corporation, based in Louisville, Kentucky, is one of the few brands in America that can boast a rich, decades-long history of success and innovation. It all started with one cook who created a soon-to-be world-famous recipe more than 70 years ago, a list of secret herbs and spices scratched out on the back of the door to his kitchen. That cook was Colonel Harland Sanders, of course, and now KFC is the world's most popular chicken restaurant chain, specializing in that same Original Recipe along with Extra Crispy_ chicken, home-style sides and buttermilk biscuits. There are more than 20,000 KFC outlets in 125 countries and territories around the world. And you know what? There's still a cook in a kitchen in every last one of them, freshly preparing delicious, complete family meals at affordable prices."
"kia","http://www.kia.com/us/en/home?cid=sem&ppc=y&aud=kia_b","WHO WE ARE  World-class design and engineering. That's our mission.  At Kia, we're inspired by the idea that you should love driving and owning your car. Designing, engineering, building, and bringing you that car is what we do. And we love what we do. Turns out we're not alone. Auto experts and everyday drivers love what we do, too. The 2017 Sportage won the Red Dot Award for Product Design in 2016. The 2016 Optima received Kelley Blue Book's KBB.com Midsize Car Best Buy Award. The word is out. The superlatives are gratifying. Yet we're determined to keep evolving.     To that end, Kia has been making news with a remarkable run of firsts. We introduced the superb K900, our first rear-drive, full-size luxury sedan. We debuted the Soul EV, our first all-electric, zero-emissions vehicle. The soon to come 2017 Optima Plug-In Hybrid is our first vehicle of its kind. The exciting firsts go on and on. From design to technology, materials to safety features, Kia continues to innovate and upgrade our entire lineup.    You deserve to own a car you love. We invite you to discover the  _New Kia. "
"kimberlyclark-corporation","http://www.kimberly-clark.com/","For more than 140 years, our values have been woven throughout the fabric of our company. The values of authentic, accountable, innovative and caring describe how we work with and are judged by our consumers, business partners, investors and each other.    Authentic: Our heritage is one of honesty, integrity and courageously doing the right thing.  Accountable: We take ownership for our business and our future.  Innovative: Our commitment is to new ideas that add value.  Caring: We respect each other and care for the communities where we live and work."
"kinder-morgan","http://www.kindermorgan.com/pages/about_us","Kinder Morgan strives for financial and operational excellence, and we are committed to being a good corporate citizen and conducting ourselves in an ethical and responsible manner. In addition to delivering value to our shareholders and meeting our customers' needs, we spend hundreds of millions of dollars each year on integrity management and maintenance programs to operate our assets safely and to protect the public, our employees, contractors and the environment."
"kindred-healthcare","http://www.kindredhealthcare.com","The word ""kindred"" has many meanings, including allied, similar and family. We believe the name reflects our business as well as our values. Ranked one of Fortune magazine's Most Admired Healthcare Companies for eight years, Kindred's mission is to promote healing, provide hope, preserve dignity and produce value for each patient, resident, family member, customer, employee and shareholder we serve."
"kitchenaid","https://www.kitchenaid.com/","In 1919 our iconic Stand Mixer was born. And from that stemmed an entire kitchen of high-performance appliances-all created with the same attention to detail, quality craftsmanship, versatile technology and timeless design. As the only appliance brand that only makes things for the kitchen, we continue to keep pushing the limits with our products so you can keep doing the same with everything you create. So, here's to you, your kitchen and the delicious world that surrounds us all."
"kkr","http://www.kkr.com/","KKR is a global investment firm that manages investments across multiple asset classes, including private equity, energy, infrastructure, real estate, credit strategies and hedge funds.    As investors with an industrialist vision, we aim to generate attractive investment returns by following a patient and disciplined approach, employing high-quality people, pursuing the highest standards of excellence, and aligning our interests with those of all our investment partners.    In addition, KKR Capital Markets supports our firm, portfolio companies, and clients by providing tailored capital markets advice and developing and implementing both traditional and nontraditional capital markets solutions for investments and companies seeking financing.    Our balance sheet is an extraordinary asset and provides us with the ability to commit significant capital side by side with our fund investors, develop new investment strategies, underwrite investment opportunities and make investments on our own behalf.    When you partner with KKR, you benefit from the breadth and expertise of the entire firm. When appropriate, all of KKR's businesses work together on behalf of all of the investors in our funds. KKR's investment partners have access to decades of financial and operational experience, broad regional and industry expertise, insight into global macro and geopolitical trends, and a powerful network of global relationships  _ both inside and outside of the firm.    Through an integrated approach across our firm, we work closely with the investors in our funds to provide innovative financial solutions and investment vehicles that best fit their respective needs. With offices around the world, we fulfill our mission one investor at a time, one company at a time--and we do this as one global firm."
